english,translate
Unlocks the Winter's Presence collection.,
Unlocks this homestead decoration for crafting.,
Unlocks this skill for use while wielding Koda's Flame.,
Unlocks this skyscale mount skin for your account.,
"Unlocks your choice of an End of Dragons Legendary Precursor weapon. Redeemable in End of Dragons.
Once this item has been acquired, it can be safely sold or discarded.",
Unopened Crystal Shard Kite,
Unopened Endless Bottle of Batwing Brew,
Unopened Endless Branded Tonic,
Unopened Endless Choya Piñata Tonic,
Unopened Endless Desert Mystery Tonic,
Unopened Endless Mystery Tonic,
Unopened Prosperity Mine Kite,
Unopened Ventari Follower Kite,
"Unpack a siege disrupter. This trick lowers outgoing damage and increases incoming damage of enemy siege equipment for 35 seconds, and it disables golems for 20 seconds. Costs 10 supply to deploy. Cannot be blocked.
Deployment Range: 1,200
Effect Radius: 300",
"Unpack a target painter. This trick marks up to 50 enemy players in the area for 30 seconds. Costs 10 supply to deploy. Cannot be avoided.
Deployment Range: 1,200
Effect Radius: 360",
Unreadable Words,
Unrefined Dredge Ore,
Unsafe Wintersday Gift,
Unscathed Lionguard Field Trowel Manual,
Unsealed Mist-Hardened Lockbox,
Unspoken Curse,
Unstable Branded Awakened Wind-Up,
Unstable Cosmic Essence,
Unstable Fractal Essence,
Unstable Hide,
Unstable Magic Volley,
Unstable Magically Charged Infusion Sample,
Unstable Metal Chunk,
Unstable Miasma,
Unstable Rag,
Unstable Rift Motivation,
Unstable Strongbox,
Untamed's Authorization Papers,
Untamed's Cache,
Untamed's Feat,
Untamed's Hammer,
Untamed's Ring,
Untamed's Stamp,
Untamed's Trinket,
Untested Speed Serum,
Unused Relic Effect Slot,
Unusual Debris 1,
Unusual Debris 2,
Unusual Debris 3,
Unusual Debris 4,
Unusual Debris 5,
Unyielding Haechi Warclaw Skin,
Updated Record of Joko's Deeds,
Updraft of a Dream,
Upgrade Extractor,
"Upgrade: ""Tips Welcome"" Sign",
Upgrade: Advertising (Black Lion Marketing Service),
Upgrade: Advertising (Gourdon Collaboration),
Upgrade: Advertising (Lion's Arch Posters),
Upgrade: Business Hours (Long),
Upgrade: Business Hours (Nocturnal),
Upgrade: Complimentary Treats,
Upgrade: Drinks (Filtered),
Upgrade: Drinks (Fountain System),
Upgrade: Food (Hydra-Lasered),
Upgrade: Food (Premium Cans),
Upgrade: Investment in Employees,
Upgrade: Souvenir (Attached Bell),
Upgrade: Souvenir (Attractive Feathers),
Upgrade: Tips (30% Minimum),
Upgrade: Tips (Automatic Suggestion),
Upgrade: Waiter (Jade Bot Alpha),
Upgrade: Waiter (Jade Bot Gamma),
Upgrade: Waiter (Jade Bot Zeta),
Upgrade: Zoomies,
Upgraded Comms Device (Experimental),
Upgraded Hologram Emitter,
"Upon applying barrier to an ally, gain increased condition duration. <c=@reminder>When this triggers, refresh the duration of all stacks.</c>",
"Upon applying might while in combat, gain Mabon's Strength. At 10 stacks, your might stacks become more effective for a duration, after which you lose all might and Mabon's Strength.",
"Upon dealing strike damage using a weapon skill with a recharge time of 20 seconds or more, deal increased strike damage for a duration. Refreshes duration on stack.",
"Upon healing an ally, shield up to four allies, redirecting a percentage of any strike damage they take to yourself. Allies may only be protected by one shield at a time.",
"Upon purchase, equips Vlast Avenger, a rifle that does extra damage to Vlast's enemies.
<c=@Flavor>Crafted by Lucius Anvilblade. Honed Slivers by Adisa. Vengeance by Vlast.</c>",
"Upon purchase, unlocks a fishing skiff and the associated Mastery track.",
"Upon striking an enemy with a weapon skill that has a recharge or resource cost, gain increased strike damage. <c=@reminder>When this triggers, refresh the duration of all stacks.</c>",
"Upon using a <c=@abilitytype>cantrip</c> or <c=@abilitytype>meditation</c> skill, gain protection.",
"Upon using a <c=@abilitytype>stance</c> skill, cleanse conditions from yourself.",
"Upon using a <c=@abilitytype>stance</c> skill, deal increased strike damage for a duration.",
"Upon using an elite skill, summon an Eye of Cerus that emits a rotating line attack, dealing damage and converting boons into conditions.",
"Upon using the final charge of a mantra skill, gain increased boon duration.",
Upper Bound,
Ura's Coffer,
Ura's Magnificent Coffer,
Ura's Steampiercer,
Ura's Token,
Urban Threat Response Training,
Urchin's Needles,
Urgent Vigil Letter,
Urgulp Friendship Bracelet,
Urn Dye,
"Urn of ""Heroic"" Ashes",
Ursan Tonic,
Ursan Weapon Chest,
"Usable by any character, this pack comes with everything a pirate captain needs to pillage, plunder, and rule the high seas.

Appearance skins override the look of your equipment and have no stats of their own.",
Use a Corrupted Jar after defeating the Claw of Jormag in Frostgorge Sound to fill it with essence.,
Use a Crystal Jar after defeating the Shatterer in Blazeridge Steppes to fill it with essence.,
Use a Destroyer Jar after defeating the Megadestroyer in Mount Maelstrom to fill it with essence.,
Use a harvesting sickle of higher quality to avoid ruining materials.,
Use a logging axe of higher quality to avoid ruining materials.,
Use a mining pick of higher quality to avoid ruining materials.,
Use a recording device to make a recording of you collecting fish for the Olmakhan.,
Use a recording device to make a recording of you defeating the Branded champions of the Grand Court of Sebelkeh.,
Use a recording device to make a recording of you defeating the Branded wyvern in Sandswept Isles.,
Use a recording device to make a recording of you defending Atholma from the storm.,
Use a recording device to make a recording of you defending captive villagers in the Bonestrand.,
Use a recording device to make a recording of you defending Elonians from the Awakened judges.,
Use a recording device to make a recording of you defending the Temple of Kormir from the Zaishen.,
Use a recording device to make a recording of you defending the village of Kweli.,
Use a recording device to make a recording of you freeing prisoners from the Deadhouse.,
Use a recording device to make a recording of you freeing the skritt of Sandswept Isles.,
Use a recording device to make a recording of you healing the injured refugees at the Temple of Kormir.,
Use a recording device to make a recording of you helping Explorer Jeppa recover lost supplies.,
Use a recording device to make a recording of you helping refugees reach the Free City of Amnoon.,
Use a recording device to make a recording of you preventing the Mordant Graveraiser from defiling the graves in Vulture Drifts.,
Use a recording device to make a recording of you rescuing cadets at the Vehtendi Academy.,
Use a recording device to make a recording of you rescuing hostages from the Awakened Garrison in the Salt Flats.,
Use a recording device to make a recording of you rescuing refugees from the mine at Glint's Legacy.,
Use a recording device to make a recording of you reviving ten fallen allies.,
Use a recording device to make a recording of you stopping a caffeinated skritt burglar.,
Use a recording device to make a recording of you stopping swindlers from cheating the people of First Camp.,
Use a recording device to make a recording of you stopping the Awakened collectors at the Arid Gladefields.,
Use a Vile Jar after defeating Tequatl the Sunless in Sparkfly Fen to fill it with essence.,
Use an Evergreen Jar after defeating the Vinewrath in Silverwastes to fill it with essence.,
"Use artificer crafting to refine into Shard of Tlehco, used to craft the legendary scepter precursor Tlehco.",
"Use artificing to refine into Shards of the Dark Arts, used to craft the legendary focus precursor Ars Goetia.",
Use Cryo Dust and the Scalding Fumes from the Molten Boss Fractal to stabilize Unstable Miasma and form an Acrid Jelly.,
"Use huntsman crafting to refine in to Shards of Liturgy, used to craft the legendary torch precursor Liturgy.",
"Use huntsman crafting to refine into a Shard of Call of the Void, used to craft the legendary warhorn precursor Call of the Void.",
"Use huntsman crafting to refine into a Shard of Spero, used to craft the legendary longbow precursor Spero.",
"Use huntsman crafting to refine into Shards o' War, used to craft the legendary rifle precursor Man o' War.",
Use in crafting recipes.,
"Use in the Mystic Forge with an Agony Infusion, an Ascended Ring, and a Philosopher's Stone to craft an Attuned Ascended Ring.
Can be bought inside the Fractals of the Mists once you have trained Agony Channeler in the Fractal Attunement Mastery line.",
Use power from the generators in the Bauxite Alchemicals Lab in Malchor's Leap to combine Acrid Jelly and Corrosive Paste to form a Destructive Substance.,
Use the Boiling-Hot Magma in the Volcanic Fractal to blend 10 Piles of Bloodstone Dust with a Corrupted Ice Shard to form Cryo Dust.,
Use the bone meal to fertilize your hidden garden in Mount Maelstrom.,
Use the cold environment found in the Underground Facility Fractal to safely react Flame Jelly with Caustic Paste at the ice pillar to form a Smouldering Concoction.,
Use the cold environment near the Frost Portal at Drakkar Spurs in Frostgorge Sound to prevent an explosion while mixing an Ever-Burning Ember with 10 Piles of Bloodstone Dust to form Blasting Powder.,
Use the compost to fertilize your hidden garden in Mount Maelstrom.,
Use the cow pie to fertilize your hidden garden in Mount Maelstrom.,
Use the equipment from Frizz's Lab in the Aetherblade Fractal to combine the Smouldering Concoction with the Combustive Substance to form a Searing Concoction.,
Use the frigid energy of the Elemental Source in the Snowblind Fractal to form Flame Jelly out of a Fire Core and 10 Piles of Bloodstone Dust.,
Use the guano to fertilize your hidden garden in Mount Maelstrom.,
Use the heat from the Heart of the Destroyer in Mount Maelstrom to fuse 10 Piles of Bloodstone Dust with an Icy Core to form Gelid Paste.,
Use the laboratory equipment found in the Thaumanova Reactor Fractal to mix a blend of Destructive Substance and your Searing Concoction to form Ever-Burning Fuel.,
Use the lasers via the console in Spekk's Lab in Caledon Forest to meld Blasting Powder with the Volatile Compound into a Combustive Substance.,
Use the low-pressure environment of Goemm's Lab high above Metrica Province to safely combine 10 Piles of Bloodstone Dust with Putrid Ichor at a Console to form a Volatile Compound.,
Use the materials from the shattered waypoint in Vexa's Lab in Fireheart Rise along with Gelid Paste to congeal the Explosive Fumes into a Corrosive Paste.,
Use the partially digested fish carcass to fertilize your hidden garden in Mount Maelstrom.,
Use the pressure found in the depths of the Aquatic Ruins Fractal to combine 10 Piles of Bloodstone Dust with Swamp Gas to form Explosive Fumes.,
"Use the Searing Cauldron near Ironhead Lake in Iron Marches to combine the Wyvern's Liquid Fire, Elemental Flames, Destroyer's Heat, a Flame Effigy Band, and a Fire Imbued Heart, to create the Ultra Hot Sphere.",
Use this box to claim one Alabaster Spider's weapon skin of your choice.,
Use this box to claim one Dark Sanctified weapon skin of your choice.,
Use this box to claim one Lunar Astrolabe weapon skin of your choice.,
Use this box to claim one Old-Growth weapon skin of your choice.,
Use this box to claim one Onyx Spider's weapon skin of your choice.,
Use this box to claim one Sanctified weapon skin of your choice.,
Use this box to claim one Solar Astrolabe weapon skin of your choice.,
Use this box to claim one Stone-Growth weapon skin of your choice.,
Use this box to claim one weapon skin of your choice.,
Use this essence to craft a completed precursor.,
Use this essence to craft a first-tier precursor.,
"Use this expertise to craft a second-tier precursor.
<c=@flavor>Most informative.<c>",
Use this item to register your account as an Extra Life donor for this year's event!,
Use this item to select a weapon type and receive a random Black Lion Weapon skin of that type.,
Use this item to select and unlock a Calligrapher's weapon skin of your choice for your account.,
Use this item to select and unlock a Fox Fire weapon skin of your choice for your account.,
Use this item to select and unlock a Gold Essence weapon skin of your choice for your account.,
Use this item to select and unlock a Magical weapon skin of your choice for your account.,
Use this item to select and unlock a Mystical Beast weapon skin of your choice for your account.,
Use this item to select and unlock a Mythic weapon skin of your choice for your account.,
Use this item to select and unlock a New Kaineng weapon skin of your choice for your account.,
Use this item to select and unlock a Red Crane weapon skin of your choice for your account.,
Use this item to select and unlock a Thundercrag weapon skin of your choice for your account.,
Use this item to select and unlock a Venombite weapon skin of your choice for your account.,
Use this item to select and unlock a Vinelord Edgebloom weapon skin of your choice for your account.,
Use this item to select and unlock a Void Corrupted weapon skin of your choice for your account.,
Use this item to select and unlock a White Tiger weapon skin of your choice for your account.,
Use this item to select and unlock an Onyx Lion weapon skin of your choice for your account. This will also unlock a bonus Gold Lion weapon skin for the same weapon.,
Use this item to select your choice of Black Lion Trading Company weapons from a special selection.,
"Use this item to select your choice of key.

Select from Zephyrite Lockpicks, Bandit Skeleton Keys, Pact Crowbars, Exalted Keys, Vials of Chak Acid, Machetes, Trader's Keys, Ornate Rusted Keys, and Mistborn Keys.",
"Use this item to teleport to a party member's location.

Ten-minute cooldown. Can only be used by characters level 10 or greater.",
Use this item to unlock a homestead crafting recipe to craft additional copies.,
"Use this item to unlock a table decoration that can change tabletops upon interaction as well as a homestead crafting recipe for additional copies.

This can only be used after Guild Wars 2: Janthir Wilds officially releases.",
Use this item to unlock a table decoration that can change tabletops upon interaction.,
Use this item to unlock recipes used to craft additional copies of each version of the Wayfinder's Versatile Table.,
Use this plunging sword finishing move to end your opponents in PvP and WvW.,
"Use this ticket to select your choice of any outfit released up to and including the Queensdale Academy Outfit.

Anniversary gifts and Black Lion exclusives not included.",
"Use this to choose 5 of one of the following dye kits: Frost, Glint's Winter, Blue Shift, Winter Chimes, Jormag, or Norn.",
"Use this to choose a Wintersday-themed chair, glider, or finisher.",
Use this to choose a Wintersday-themed miniature.,
Use this to choose a Wintersday-themed outfit.,
Use this to choose a Wintersday-themed weapon.,
"Use this to receive 5,000 PvP rank points.",
Use this to select a weapon skin from the War Machine collection.,
"Use this to sign your account up for weekly End of Dragons Launch Supply Drops. Receive the first drop immediately and three more between now and March 21.

First Drop:
A Red Crane Weapon Choice, 5 Black Lion Chest Keys, a Golden Black Lion Chest Key, and 5 <REDACTED> Dye Kits.
Second Drop:
A Black Lion Backpack and Glider Combo Voucher, an End of Dragons Expedition Board, and 2 Heroic Boosters.
Third Drop:
A Black Lion Outfit Voucher, a Black Lion Weapon Voucher, 2 Fine Black Lion Dye Canisters—Blue, 2 Fine Black Lion Dye Canisters—Green, 2 Fine Black Lion Dye Canisters—Red, and 2 Fine Black Lion Dye Canisters—Yellow.
Fourth Drop:
A Gold Essence Weapon Choice, 2 Guaranteed Wardrobe Unlocks, and 2 Black Lion Miniature Claim Tickets.",
"Use this to sign your account up for weekly Janthir Wilds Launch Supply Drops. Receive the first drop immediately and three more between now and September 9.

First Drop:
A Janthir Wilds Contract Board, a Wild Roar Mount Select License, and 2 Heroic Boosters.
Second Drop:
A Black Lion Outfit Voucher, a Wisteria Spear Skin, and 3 Smooth Berry Dye Kits.
Third Drop:
A Void Corrupted Weapon Choice, a Black Lion Backpack and Glider Voucher, and a Communal Boost Bonfire.
Fourth Drop:
5 Black Lion Chest Keys, a Black Lion Weapons Voucher, and a Golden Black Lion Chest Key.",
"Use this to sign your account up for weekly Secrets of the Obscure Launch Supply Drops. Receive the first drop immediately and three more between now and September 4.

First Drop:
An Amnytas Feathered Raptor Mount Pack, 1 Black Lion Cape Voucher, and 2 Heroic Boosters.
Second Drop:
A Black Lion Backpack and Glider Combo Voucher, a ""/Readbook"" Emote Tome, 2 Guaranteed Wardrobe Unlocks, and a Communal Boost Bonfire.
Third Drop:
A Black Lion Finisher Voucher, a Black Lion Weapons Voucher, and 3 Seven Dragon Dye Packs.
Fourth Drop:
5 Black Lion Chest Keys, 2 Black Lion Miniature Claim Tickets, and a Golden Black Lion Chest Key.",
"Use this to sign your account up for weekly Visions of Eternity Launch Supply Drops. Receive the first drop immediately and three more between now and November 25.

First Drop:
A Visions of Eternity Contract Board, a Vibrant Companions Mount Select License, and 2 Heroic Boosters.
Second Drop:
A Black Lion Outfit Voucher, a Painter's Brilliance Backpack and Glider Combo, and an Equipment Template Expansion.
Third Drop:
An Elite Weapons Voucher, 3 Monstrous Dye Kits, and 2 Communal Boost Bonfires.
Fourth Drop:
A Calligrapher's Weapon Choice box, 5 Black Lion Chest Keys, and a Golden Black Lion Chest Key.",
Use this to water your hidden garden in Mount Maelstrom.,
Use this torch to find your way in the dark.,
Use this voucher to claim a full set of Black Lion Trading Company weapons.,
Use this voucher to select your choice of armor skins from a special selection.,
Use this voucher to select your choice of backpack and glider combos from a special selection.,
Use this voucher to select your choice of backpack from a special selection.,
Use this voucher to select your choice of backpack glider from a special selection.,
Use this voucher to select your choice of Black Lion Trading Company capes from a special selection.,
Use this voucher to select your choice of Black Lion Trading Company finishers from a special selection.,
Use this voucher to select your choice of Black Lion Trading Company held toys from a special selection.,
Use this voucher to select your choice of Black Lion Trading Company musical instruments from a special selection.,
Use this voucher to select your choice of Black Lion Trading Company weapons from a special rarer selection.,
Use this voucher to select your choice of Black Lion Trading Company weapons from a special selection.,
Use this voucher to select your choice of cape from a special selection.,
Use this voucher to select your choice of glider from a special selection.,
Use this voucher to select your choice of mount skin from a special selection.,
Use this voucher to select your choice of outfit from a special selection.,
Use this voucher to select your choice of outfits from a special selection.,
Use this voucher to select your choice of weapon from a special selection.,
Use to channel a mysterious power. This power frequently crystalizes valuable items from the energy of defeated enemies.,
"Use to construct a ballista build site. The ballista's primary function is to deal heavy single-target damage to siege equipment and infantry. Range 3,000. Requires 30 supply to complete.",
"Use to construct a cannon build site. The cannon's primary function is to deal heavy area damage to players. The cannon has a range of 3,750 and requires 50 supply to complete.",
"Use to construct a catapult build site. The catapult's primary function is to deal heavy area damage to walls or moderate damage to gates. Range 4,000. Requires 40 supply to complete.",
Use to construct a flame ram build site. The flame ram's primary function is to deal heavy damage to gates. Unable to damage walls. Range 360. Requires 40 supply to complete.,
"Use to construct a shield generator build site. The generator's primary function is to project force fields in order to disrupt enemy movement and support allies. Range 3,750. Requires 40 supply to complete.",
Use to construct a siege golem build site. It has autoswitching capabilities to attack with rockets at a range of 1500 or to melee. Requires 125 supply to complete.,
"Use to construct a trebuchet build site. The trebuchet's primary function is to deal heavy area damage to walls or moderate damage to gates. Range 10,000. Requires 50 supply to complete.",
"Use to construct a trebuchet build site. The trebuchet's primary function is to deal heavy area damage to walls or moderate damage to gates. Range 10,000. Requires 60 supply to complete.",
Use to construct a United Legions arrow cart. The arrow cart deals moderate area damage to infantry. Can only be used in Drizzlewood Coast and lasts 5 minutes or until destroyed.,
Use to construct a United Legions ballista. The ballista deals heavy single-target damage to siege equipment and infantry. Can only be used in Drizzlewood Coast and lasts 5 minutes or until destroyed.,
Use to construct a United Legions catapult. The catapult deals moderate area damage to infantry. Can only be used in Drizzlewood Coast and lasts 5 minutes or until destroyed.,
Use to construct a United Legions flame ram. The flame ram deals heavy damage to gates. Can only be used in Drizzlewood Coast and lasts 5 minutes or until destroyed.,
"Use to construct an arrow cart build site. The arrow cart's primary function is to deal moderate area damage to infantry. Range 2,500. Requires 25 supply to complete.",
"Use to construct an arrow cart build site. The arrow cart's primary function is to deal moderate area damage to infantry. Range 2,500. Requires 30 supply to complete.",
Use to craft Leaf of Kudzu.,
Use to create War Supplies that can be used or traded in the Drizzlewood Coast.,
Use to exchange this blueprint for a functional catapult blueprint.,
"Use to gain a Supply Removal trap. This trap removes 5 supply from enemies when activated. Costs 10 supply to deploy.
Effect Radius: 1200",
"Use to gain a Target Painter trap. This trap marks up to 50 enemies when activated. Costs 5 supply to deploy. Cannot be avoided.
Effect Radius: 1,200",
Use to gain access to any infinite siege equipment blueprints you've unlocked.,
Use to gain access to the Light of Deldrimor treasure chamber.,
Use to gain the Black Lion Chest exclusive dye Blue Lion.,
Use to gain the Black Lion Chest exclusive dye Red Lion.,
Use to gain the Black Lion Chest exclusive dye Yellow Lion.,
Use to gain the Black Lion Chest exclusive Green Lion Dye.,
Use to place a crafting station of your choice in most places. Requires 4 minutes to recharge.,
Use to redeem this voucher for your choice of any map or dungeon currency.,
Use to teleport to a party member's location.,
"Use to unlock exclusive Black Lion Chest blue dyes, or use to combine several canisters and upgrade their rarity.",
"Use to unlock exclusive Black Lion Chest green dyes, or use to combine several canisters and upgrade their rarity.",
"Use to unlock exclusive Black Lion Chest red dyes, or use to combine several canisters and upgrade their rarity.",
"Use to unlock exclusive Black Lion Chest yellow dyes, or use to combine several canisters and upgrade their rarity.",
"Use Weaponsmith crafting to refine into Shard of Exitare, used to craft the legendary greatsword precursor Exitare.",
"Use weaponsmith crafting to refine into Shard of Resolution, used to craft the legendary dagger precursor Claw of Resolution.",
"Use weaponsmithing to refine into Shards of Arah, used to craft the legendary hammer precursor Might of Arah.",
"Use weaponsmithing to refine into Shards of Endeavor, used to craft the legendary mace precursor Endeavor.",
"Use weaponsmithing to refine Tribute[s] to Friendship into Shards of Friendship, which are used to craft the legendary shield precursor, Friendship.",
"Use weaponsmithing to refine Tribute[s] to the Queen into Shards of the Crown, which are used to craft the legendary-sword precursor, Save the Queen.",
Use with the Light of Deldrimor Plate—Bottom Half to gain the Reassembled Light of Deldrimor Plate. This will consume both halves.,
Use with the Light of Deldrimor Plate—Top Half to gain the Reassembled Light of Deldrimor Plate. This will consume both halves.,
Use your opponent as fertilizer for this lethal finishing move in PvP and WvW.,
Used Bird Whistle,
Used by Draithor the Drill in Kessex Hills in his necromantic experiments.,
Used by the Mystic Forge to change one material into another.,
Used by the Mystic Forge to convert arcane components.,
Used by the Mystic Forge to produce PvP items.,
Used by the Mystic Forge to upgrade siege weapons.,
Used by the Mystic Forge.,
Used by the Mystic Forge. This is not a real weapon.,
"Used by the new settlers of Southsun, these chests have a rare chance to contain a token for a new sclerite weapon skin, and even more rarely, new mini pets.",
Used for crafting and purchasing items. Earn daily from each story journal chapter.,
"Used for crafting ascended gear with the Grieving (+Power, +Condition Damage, +Ferocity, +Precision) stat combo.

Can be found at the same location as elegy mosaics.",
Used for crafting Dragon Slayer weapons.,
Used for crafting Restored Boreal weapons.,
Used for tournaments which require an entry fee.,
Used Grow Lamp,
Used Hardy Ball,
Used Heavy-Duty Dolyak Blanket,
Used in conjunction with a fishing rod and bait to catch fish.,
Used in conjunction with a fishing rod and lure to catch fish.,
"Used in crafting Antique Canthan armor, using the Ritualist's (+Condition Damage, +Concentration, +Vitality, +Expertise) stat combination.",
