english,translate
Achievements and lifetime statistics are not affected.,
Achievements related to current special events.,
Achievements related to new regions.,
Achievements related to the current festival celebration.,
Achievements related to the current World vs. World tournament.,
Achievements related to the Tequatl the Sunless encounter.,
Achievements related to World versus World.,
Achievements<br>Click to Toggle Details,
Acid Bath,
Acid Dye[s],
Acid Explosion,
Acid Rain,
Acidic Coating,
Acidic Elixirs,
Acidic Mist,
Acknowledgement[s] to Deft Lahar,
Acolyte Ellyna Graidy,
Acolyte of Balthazar,
"Acolyte of Balthazar Loot Box[pl:""Boxes""]",
Acolyte of Peace,
acolyte unnarmed,
Acquire 3 cold-resistant eggshells.,
Acquire a completed memory of Jormag by collecting enough memory fragments of Elder Dragons.,
Acquire a completed memory of Kralkatorrik by collecting enough memory fragments of Elder Dragons.,
Acquire a completed memory of Mordremoth by collecting enough memory fragments of Elder Dragons.,
Acquire a completed memory of Primordus by collecting enough memory fragments of Elder Dragons.,
Acquire a completed memory of Soo-Won by collecting enough Fragmented Elder Dragon Memories.,
Acquire a completed memory of Zhaitan by collecting enough memory fragments of Elder Dragons.,
Acquire a corrupted ice shard from the chest after killing the Claw of Jormag in Frostgorge Sound.,
Acquire a garden plot for your home instance from Mender Earie.,
Acquire a Living Crystal from the Earth Elemental in the Tangled Depths and use it to capture energy left over in the pillars after defeating the Vale Guardian in Spirit Vale.,
Acquire a replacement golem arm from the Inquest and use it to repair IG-6417.,
Acquire a skimmer from Trainer Ardra.,
Acquire a Soul Mirror from Burnisher Kengo in Auric Basin and use it to capture spectral energy from the lit ghost sconce at the exit of the Spirit Woods in Spirit Vale.,
Acquire an ever-burning ember from Drakin Cinderspire's chest in the Iron Marches.,
Acquire an icy core from the chest after defeating the Svanir Shaman Chief at the Frozen Maw in Wayfarer Foothills.,
acquire gems and use them in both the Gem Store and Currency Exchange.,
Acquire Guild Hall,
Acquire hammers and perform structural repairs.,
Acquire putrid ichor from the chest after defeating Tequatl the Sunless in Sparkfly Fen.,
Acquire recording devices from Researcher Thale in order to make recordings to teach IG-6417.,
Acquire swamp gas from the Mossman in the Swampland Fractal.,
Acquire the Dragonsblood focus.,
Acquire the Dragonsblood scepter.,
Acquire the Guild Miniature Merchant 2 upgrade.,
Acquire the Guild Miniature Merchant 3 upgrade.,
Acquire the heroic spirit of Asaliea: deed #1.,
Acquire the heroic spirit of Asaliea: deed #2.,
Acquire the heroic spirit of Asaliea: deed #3.,
Acquire the heroic spirit of Azra: deed #1.,
Acquire the heroic spirit of Azra: deed #2.,
Acquire the heroic spirit of Azra: deed #3.,
Acquire the heroic spirit of Baverne: deed #1.,
Acquire the heroic spirit of Baverne: deed #2.,
Acquire the heroic spirit of Baverne: deed #3.,
Acquire the heroic spirit of Belitrea: deed #1.,
Acquire the heroic spirit of Belitrea: deed #2.,
Acquire the heroic spirit of Belitrea: deed #3.,
Acquire the heroic spirit of Carver: deed #1.,
Acquire the heroic spirit of Carver: deed #2.,
Acquire the heroic spirit of Carver: deed #3.,
Acquire the heroic spirit of Codd: deed #1.,
Acquire the heroic spirit of Codd: deed #2.,
Acquire the heroic spirit of Codd: deed #3.,
Acquire the heroic spirit of Durio: deed #1.,
Acquire the heroic spirit of Durio: deed #2.,
Acquire the heroic spirit of Durio: deed #3.,
Acquire the heroic spirit of Elegos: deed #1.,
Acquire the heroic spirit of Elegos: deed #2.,
Acquire the heroic spirit of Elegos: deed #3.,
Acquire the heroic spirit of Hakson: deed #1.,
Acquire the heroic spirit of Hakson: deed #2.,
Acquire the heroic spirit of Hakson: deed #3.,
Acquire the heroic spirit of Haliver: deed #1.,
Acquire the heroic spirit of Haliver: deed #2.,
Acquire the heroic spirit of Haliver: deed #3.,
Acquire the heroic spirit of Katarin: deed #1.,
Acquire the heroic spirit of Katarin: deed #2.,
Acquire the heroic spirit of Katarin: deed #3.,
Acquire the heroic spirit of Kobbel: deed #1.,
Acquire the heroic spirit of Kobbel: deed #2.,
Acquire the heroic spirit of Kobbel: deed #3.,
Acquire the heroic spirit of Mirren: deed #1.,
Acquire the heroic spirit of Mirren: deed #2.,
Acquire the heroic spirit of Mirren: deed #3.,
Acquire the heroic spirit of Mosa: deed #1.,
Acquire the heroic spirit of Mosa: deed #2.,
Acquire the heroic spirit of Mosa: deed #3.,
Acquire the heroic spirit of Mouglon: deed #1.,
Acquire the heroic spirit of Mouglon: deed #2.,
Acquire the heroic spirit of Mouglon: deed #3.,
Acquire the heroic spirit of Wossaul: deed #1.,
Acquire the heroic spirit of Wossaul: deed #2.,
Acquire the heroic spirit of Wossaul: deed #3.,
Acquire the notes of the researchers from the chest inside the Thaumanova Reactor Fractal.,
Acquire the tome entry called Chasing Tales: Codd the Cheerful.,
Acquire the tome entry Chasing Tales: Azra the Sunslayer.,
Acquire the tome entry Chasing Tales: Baverne the Hunter.,
Acquire the tome entry Chasing Tales: Carver the Carver.,
Acquire the tome entry Chasing Tales: Durio the Contemptuous.,
Acquire the tome entry Chasing Tales: Elegos the Harmless.,
Acquire the tome entry Chasing Tales: Haliver the Seeker.,
Acquire the tome entry Chasing Tales: Katarin the Bonecrusher.,
Acquire the tome entry Chasing Tales: Kobbel the Poetic.,
Acquire the tome entry Chasing Tales: Mosa the Majestic.,
Acquire the tome entry Chasing Tales: Mouglon the Watchful.,
Acquire the tome entry Chasing Tales: Wossaul the Giant.,
Acquire this relic as a tier reward from the Mount Balrior: Convergence Conqueror achievement or from the Janthir Wilds reward track.,
Acquire this relic by completing the Convergence Challenge Mode—Decima: Silver achievement or from the Janthir Wilds reward track.,
Acquire this relic by completing the Convergence Challenge Mode—Greer: Silver achievement or from the Janthir Wilds reward track.,
Acquire this relic by completing the Convergence Challenge Mode—Ura: Silver Achievement or from the Janthir Wilds reward track.,
Acquire this relic from a renown heart vendor in Coursing Upland in Lowland Shore or from the Janthir Wilds reward track.,
Acquire this relic from a renown heart vendor in Festering Basin in Janthir Syntri or from the Janthir Wilds reward track.,
Acquire this relic from a renown heart vendor in Janthir Syntri or the Janthir Wilds Reward Track.,
Acquire this relic from a renown heart vendor in Lowland Shore or the Janthir Wilds Reward Track.,
Acquire this relic from Deft Lahar in Hearth's Glow or the Janthir Wilds reward track.,
Acquire this relic from the Bava Nisos Explorer achievement or from the Janthir Wilds reward track.,
Acquire this relic from the Bava Nisos Mastery achievement or from the Janthir Wilds reward track.,
Acquire this relic from the Bava Nisos Rift Hunting achievement or from the Janthir Wilds reward track.,
Acquire this relic from the Castoran Curse-Breaker achievement or the Visions of Eternity reward track.,
Acquire this relic from the Eternal Watch achievement or the Visions of Eternity reward track.,
Acquire this relic from the Eternity's Garden Explorer achievement or the Visions of Eternity reward track.,
Acquire this relic from the Eternity's Garden Mastery achievement or the Visions of Eternity reward track.,
Acquire this relic from the Janthir Syntri Mastery achievement or the Janthir Wilds Reward Track.,
Acquire this relic from the Janthir Wilds: Act 1 Mastery achievement or the Janthir Wilds Reward Track.,
Acquire this relic from the Janthir Wilds: Act 2 Mastery achievement or the Janthir Wilds Reward Track.,
Acquire this relic from the Janthir Wilds: Godspawn Mastery achievement or the Janthir Wilds reward track.,
Acquire this relic from the last spearmarshal.,
Acquire this relic from the Lowland Shore Mastery achievement or the Janthir Wilds Reward Track.,
Acquire this relic from the Starlit Weald Mastery achievement or from the Visions of Eternity reward track.,
Acquire this relic from the unusual or ancient coin vendors in Lowland Shore and Janthir Syntri or from the Janthir Wilds reward track.,
Acquire this relic from the Visions of Eternity reward track or by completing the story chapter So It Is Written.,
Acquire this relic from Visions of Eternity: The Only Way Mastery achievement or the Visions of Eternity reward track.,
"Acquired ""%str1%"" right",
Acquired a Dragonsblood axe.,
Acquired a Dragonsblood dagger.,
Acquired a Dragonsblood focus.,
Acquired a Dragonsblood greatsword.,
Acquired a Dragonsblood hammer.,
Acquired a Dragonsblood longbow.,
Acquired a Dragonsblood mace.,
Acquired a Dragonsblood pistol.,
Acquired a Dragonsblood rifle.,
Acquired a Dragonsblood scepter.,
Acquired a Dragonsblood shield.,
Acquired a Dragonsblood short bow.,
Acquired a Dragonsblood staff.,
Acquired a Dragonsblood sword.,
Acquired a Dragonsblood torch.,
Acquired a Dragonsblood warhorn.,
Acquired as a rare drop from the Guardian's Glade raid encounter or available for purchase from the Visions of Eternity raid vendor after completing the encounter once.,
Acquired as a reward by completing the Castoran Curse-Breaker achievement.,
Acquired as a reward by completing the Eternal Watch achievement.,
Acquired as a reward by completing the Eternity's Garden Explorer achievement.,
Acquired as a reward by completing the So It Is Written achievement.,
Acquired as a reward by completing the Visions of Eternity: The Only Way Mastery achievement.,
Acquired as a tier reward from the Eternity's Garden Mastery achievement.,
Acquired as a tier reward from the Janthir Syntri Mastery achievement.,
Acquired as a tier reward from the Janthir Wilds: Act 1 Mastery achievement.,
Acquired as a tier reward from the Janthir Wilds: Act 2 Mastery achievement.,
Acquired as a tier reward from the Lowland Shore Mastery achievement.,
Acquired as a tier reward from the Shipwreck Strand Mastery achievement.,
Acquired as a tier reward from the Starlit Weald Mastery achievement.,
Acquired as a tier reward from the Visions of Eternity: Act 1 Mastery achievement.,
Acquired as a tier reward from the Visions of Eternity: Act 2 Mastery achievement.,
"Acquired by completing ""Champions"" Mastery.",
Acquired by harvesting soybeans as a mesmer.,
Acquired by harvesting soybeans as a necromancer.,
Acquired by harvesting soybeans as an elementalist.,
Acquired by mining jade nodes as a guardian.,
Acquired by mining jade nodes as a revenant.,
Acquired by mining jade nodes as a warrior.,
Acquired from a quaestor in Drizzlewood Coast.,
Acquired from a rally provisioner in Grothmar Valley.,
Acquired from Anette Eymundrdottir in Bjora Marches.,
Acquired from completing the Hammerhart Rumble! world boss event in Shipwreck Strand.,
Acquired from completing the Secrets of the Weald meta-event in Starlit Weald.,
Acquired from Convergences.,
Acquired from Crystallographer Smoxxi in the Eye of the North.,
Acquired from petrified Echovald saplings as a ranger.,
Acquired from petrified Echovald saplings as a thief.,
Acquired from petrified Echovald saplings as an engineer.,
Acquired from the A New Look achievement.,
Acquired from the Defense of Amnytas meta-event.,
Acquired from the final events in the Road to Heitor or the Fangs That Gnash event chains.,
Acquired from the Inner Nayos Mastery III achievement.,
Acquired from the Into the Spider's Lair meta-event.,
Acquired from the Mabon's Fate story chapter.,
Acquired from the Sovereign of Nayos story chapter.,
Acquired from the Survivors story chapter.,
Acquired from the Unlocking the Wizard's Tower meta-event.,
Acquired Supply,
"Acquiring nicer gear lets you collect skins to change your look as you progress. Open the Hero Panel and click on ""Wardrobe"" to swap the look of your equipment with skins you've collected.",
"Acquiring the mysterious krait orb won't be easy, but letting yourself be captured will get you close enough to try...if you survive.",
Acquiring this item demonstrates the Crystal Bloom's readiness to join the battle and instantly grants you karma.,
"Acrid Jelly[pl:""Jellies""]",
"Acrophobia[pl:""Acrophobia""]",
"Across all characters, you have played for %num1% hour[s] %num2% minute[s] over the past %num3% day[s].",
"Across all characters, you have played for %num1% hour[s] %num2% minute[s] over the past %num3% month[s].",
"Across Elona, the prophecy of Nightfall is one of our most well-known but least-understood texts.Now, using the analytical techniques of Malomedies, we can finally explore the world as it was leading up to Abaddon's calamitous escape attempt from the Realm of Torment. Through knowledge hidden in the stars, we can see firsthand how Varesh Ossa's plot unfolded with a clarity unlike any seen before.Experience a brand-new side of this monumental historical event, learning invaluable techniques in the art of astronomical divination along the way!",
Across the wide river.,
Act with honor. Speak with integrity.,
Action Cam,
Action Camera Reticle Settings,
Action Camera Toggle,
Action-oriented combat,
Activate (Engineers Only),
Activate Console (Costs 1 Charge),
Activate Portal,
"Activate Slipstream Boost to allow for increased height gain when using Hover, as well as increased base movement speed for the duration of the skill.",
Activate the Bloodstone Ascender to unleash its ruinous power and float through the air instead of running. Engaging in combat will end the effect.  You will automatically reequip this item while running outside of combat if you have the Automatic Bloodstone Ascender effect enabled on your character.,
Activate the Crystalline Heart and survive the Cairn the Indomitable encounter without being hit by Spatial Manipulation.,
Activate the Crystalline Heart and survive the Deimos encounter in the Bastion of the Penitent.,
Activate the Crystalline Heart and survive the Recreation Sector in the Bastion of the Penitent after being protected by its defenses.,
Activate the Crystalline Heart and use it to absorb energy from Rigom in the Bastion of the Penitent.,
Activate the Dwarven Spell Trap before defeating Fleshgrazer inside Forsaken Fortune in Dredgehaunt Cliffs to collect its ancient magic.,
Activate the Dwarven Spell Trap before defeating the Fleshreaver inside the cave at Onager Bivouac in Fireheart Rise to collect its ancient magic.,
Activate the Dwarven Spell Trap before defeating the Legendary Karka Queen in Southsun Cove to collect her ancient magic.,
Activate the Electromagnetic Ascender to harness the power of electricity and float through the air instead of running. Engaging in combat will end the effect.  You will automatically reequip this item while running outside of combat if you have the Automatic Electromagnetic Ascender effect enabled on your character.,
"Activate the golem's stealth generator, becoming undetectable.",
Activate the M-PEC before defeating a Champion Arrowhead at Arrowhead Vale in Auric Basin to gather its mucus.,
"Activate the M-PEC before defeating a Champion Mushroom Emperor in Tangled Depths, Auric Basin, or Dragon's Stand to gather its spores.",
Activate the M-PEC before defeating a Champion Stonehead near the Griffonfall Pylon in Auric Basin to gather its salivary stone.,
Activate the M-PEC before defeating a Veteran Bloodsucker inside the caves of Auric Basin to gather its enzymes.,
Activate the M-PEC before defeating a Veteran Deep Cave Troll found inside the damp caverns in either Auric Basin or Tangled Depths to gather its saliva.,
Activate the M-PEC before defeating the Veteran Follower of Zintl outside the Capitzel Grounds in Auric Basin to gather their beetle's juice.,
Activate the Magic Carpet in your inventory to feel the breeze against your face. You will be removed from the Magic Carpet if you engage in combat.This item has no movement-speed bonus or additional skills.,
Activate the Portal,
"Activate the power core, gaining boons.",
"Activate the sonic tunneling tool in inventory, and you can move just below the surface instead of running. The tunneling wave is fragile, though, and you will surface if you engage in combat.  This item has no movement speed bonus or additional skills.",
"Activate the Soul Battery Fragment before defeating Karas the Undying, west of Rayhan Bayt in Malchor's Leap, to capture its soul energy.",
"Activate the Soul Battery Fragment before defeating the Champion Risen Knight, located near the Dwayna Statue in Malchor's Leap, to capture its soul energy.",
Activate the Soul Battery Fragment before defeating the Legendary Risen High Wizard at the Narthex in Cursed Shore to capture its soul energy.,
"Activate the Soul Battery Fragment before defeating the Risen King, located inside the Reliquary Vault of Cursed Shore, to capture its soul energy.",
Activate this broom to ride around in the world. Perfect for taking a spin around Tyria so long as you avoid enemies knocking you off it.  This item has no movement speed bonus or additional skills.,
"Activate this to unlock a Spiritwood Fishing Rod skin.<br><br><c=@flavor>""A rod fit for only the greatest of fisherfolk!"" —Ukyo</c>",
"Activate this to unlock a Striped Fishing Rod skin.<br><br><c=@flavor>""Very much a classic bamboo rod, but with a splash of colorful red and green stripes!"" —Lin</c>",
Activate your golem's shield bubble to block projectiles. Also heals nearby allies.,
"Activate your inertial accelerator, gaining quickness.",
Activates a shield that protects the siege weapon and its user from other siege weapons skills.,
Activates a shield that protects the siege weapon and its user from projectiles.,
"Activates Balanced Stance when disabled (stun, daze, knockback, pull, knockdown, sink, float, fear, or launch).",
Activating a signet removes a condition.,
Activating Build Template %str1%,
Activating Equipment Template %str1%,
Activating Template,
Activating the Heart of the Obscure near demonic rifts will lure out the Kryptis hiding inside. Defeat Kryptis foes in order to coax their champions to the fray.,
Activating Virtue of Courage also breaks stun for any ally affected by the ability.,
Active %str1%,
Active Bonus,
Active Finisher:,
Active Incursion,
Active Kill Streak!,
Active Members,
Active Missions,
Active Power Increase,
Active tabs,
"Activities are fun minigames by which you can participate in things you can't normally do in the game. You can find them throughout Tyria, especially during holidays.",
"Activities are fun minigames that allow you to participate in things you can't normally do in the game. You can find them throughout Tyria, especially during festivals and events.",
Activity Completed,
"Activity Director, Lion's Arch",
Activity Lead Kouris,
Activity Test Map,
"Adal, Unyielding Firmament",
Add %str1% to your Legendary Armory? This will consume the item so it can be used on any character on your account.,
Add (NUM),
Add / Search,
Add a Build Storage Space accessible by all characters on the account.,
Add a defiance bar.,
Add a new tab,
Add a relic effect to improve your build.,
Add Achievement Point Filter,
Add Admin,
Add an additional character slot to your account.,
Add an additional inventory slot to all characters on the account. Each slot allows all characters to share one non-bag item.,
Add an Enchanted Colorful Snowball to the Novelties section of the Hero panel to unlock this upgrade! Limit 1 per customer.,
Add an extra bag slot to a character's inventory.,
Add an extra bag slot to a character's inventory. Each character can purchase 5 additional bag slots.,
"Add an extra bank tab to your account.Each account can have up to 19 tabs, including any previously purchased in-game tabs.",
"Add an extra bank tab to your account.Each account can purchase up to 14 additional tabs, including any previously purchased in-game.",
"Add an extra bank tab to your account.Each account can purchase up to 16 additional tabs, including any previously purchased in-game.",
"Add an extra bank tab to your account.Each account can purchase up to 9 additional tabs, including any previously purchased in-game.",
Add an extra Build Template tab to a character.,
Add an extra Equipment Template tab to a character.,
"Add an extra Fashion Template tab to your account, accessible by all characters.Each account can unlock up to 7 additional Fashion Template tabs.",
Add an item to this %str1% slot from the Novelties section of the Hero panel.,
Add an upgrade to this empty slot to improve your build.,
Add boons.,
Add Code,
Add condition immunity.,
Add conditions.,
Add Core Mastery Point Filter,
Add cripple and weakness to your plague.,
Add days to any custom arena. Each token adds one day.,
Add End of Dragons Mastery Point Filter,
Add Friend,
Add Guild,
Add Heart of Thorns Mastery Point Filter,
Add Icebrood Saga Mastery Point Filter,
Add Janthir Wilds Mastery Point Filter,
Add Log,
Add logs to the fire to cook the meat.,
"Add mail carriers to your collection, or browse and equip mail carriers from your current collection.",
Add Mastery Point Filter,
Add Mastery Point Filter...,
Add Member,
"Add miniatures to your collection, or browse and equip minis from your current collection.",
Add more Build Template tabs to your characters!,
Add more compatible ingredients!,
Add more Equipment Template tabs to your characters!,
Add more Fashion Template tabs to your account!,
Add movement.,
Add one space to your account's Build Storage. This discounted item is available only once per account.,
Add Path of Fire Mastery Point Filter,
Add power to 75 starlight lanterns.,
Add Rewards Filter,
Add Secrets of the Obscure Mastery Point Filter,
Add server to favorites,
Add SMS!,
Add some more junk to your trunk with bag slots and bank slots going on sale!,
Add strike damage immunity.,
"Add the selected decoration to the environment. Press again to confirm placement, or use Move/Rotate/Scale for more control. The decoration palette will open if no decoration is selected. A warning will display if decoration limits are exceeded.",
Add this achievement to your watch list.,
Add Time,
Add Titles Filter,
Add to Account Wardrobe,
Add to Bonfire,
Add to Collection,
Add to Favorites,
Add to Friends,
Add to Legendary Armory,
"Add toys, chairs, musical instruments, and held items to your collection, or browse and equip these items from your current collection.",
Add Visions of Eternity Mastery Point Filter,
Add/Remove from Favorites,
Adding an upgrade of a higher rarity will improve your attributes.,
Adding Tips to Duo,
Additional Ammunition,
Additional areas to turn in calibrated essence have appeared throughout Mount Balrior.,
Additional Audio Support,
Additional Bag Slot,
Additional Bleeding per Malice,
Additional Burning,
Additional Casting,
Additional charge granted,
Additional Conditions Removed,
Additional Damage per Condition,
Additional Defiance Bar Damage,
Additional enemy creatures have spawned.,
Additional Firepower Activated,
"Additional Gold[pl:""Gold""]",
Additional Guards,
Additional Hit Fury,
Additional Hit Might,
Additional items may be unequipped from other Equipment Templates.,
Additional Karka Attacks,
Additional Might,
Additional Might Granted,
Additional options.,
Additional Poison,
Additional Protection per Clone,
Additional related items have been unequipped and returned to your inventory.,
Additional Shared Inventory Slots Available!,
Additional Stock Available for Dragon Ball Champions,
Additional Strike,
Additional Support,
Additional Torment,
Additional Vulnerability,
Additional-Hit Might,
Adds a burning effect.,
Adds a cannon to the walls of the tower.,
Adds a flame effect.,
Adds a flame shield effect.,
Adds a pot of boiling oil over the door.,
Adds a waypoint to the castle that can be used if it is not under attack.,
Adds a waypoint to the keep that can be used if the keep is not under attack.,
Adds burning damage.,
Adds flame to attack.,
Adds Imperial Favor[s] to your wallet.,
"Adds light rays, tinting, and other effects for best appearance.",
Adds shadows to small details.,
Adelbern's Sword,
Adept Chest[s] of the Mists,
Adept Decorations,
Adept Scales 26–50,
Adept's Bag[s] of Crafting Supplies,
Adept: Intermediate fractals with better rewards. Designed for organized groups who can coordinate tactics.<br>Required level: <c=@abilitytype>80</c>,
Adiabatic Cooling,
Adjust Box of Fun,
Adjust Camera to Character Height,
Adjust Camera View,
Adjust environment.,
Adjust Formula,
Adjust golem settings.,
Adjust self.,
Adjust Spell,
Adjust the amount of time a skill waits to activate if used during another skill. Higher values improve casting on high-latency connections. (%num1%-%num2% milliseconds),
Adjust your facial features.,
Adjusted:,
Adjusts how quickly the mouse moves your camera.,
Adjusts the gamma level (brightness and contrast) for the entire screen. Only works in full-screen mode.,
"Adjusts the Vacuumagic's polarization from ""suck"" to ""blow,"" knocking back up to three targets.",
Adjusts the zoomed-in camera position behind your character.,
Administer the medicine to the skyscale and consult Dyanne.,
Administrative Assistant,
Administrators are allowed to use the same commands as the owner to help administer the custom arena.,
Admiral Clarinda Demard,
Admiral Clarinda Demard acknowledges your assistance.,
Admiring a massive jade monument.,
Admiring mushrooms.,
Admiring the sounds of the marketplace by the Kaineng Docks.,
Admiring the staircase of Eventide's March.,
Admit it—the Council stood their ground. They're stronger than you thought they were.,
"Adnul Irongut, a norn epicurean, is currently enjoying his native cuisine in Hoelbrak.",
Adobe Dye[s],
Adobe Sunset Dye[s],
Adolescent Abyssal Watcher,
Adolescent Beetle,
Adolescent Siege Turtle,
Adopt a new version of your mounts.,
Adopt Another,
Adopt everything!,
