english,translate
Complete the Glimmering Resin Weapon Collection.,
"Complete the Gnashbash ""Birthday"" Celebration achievements for extra prizes.",
Complete the Guardian of the Vale achievement to unlock this purchase.,
"Complete the Guardian of the Vale achievement, then purchase a Proof of Spirit Vale Completion from the raid vendor in the raid lobby.",
Complete the Guardian's Glade Raid or 10 Quickplay Raids,
Complete the Guardian's Glade raid or any 10 quickplay raids.,
Complete the guild rush course.,
Complete the Guild Wars 2: Visions of Eternity launch story with this character.,
Complete the Guild Wars 2: Visions of Eternity story chapter So It Is Written with this character.,
"Complete the Hammerhart Rumble meta-event in Castora, events in Shipwreck Strand, or events in Orr. Completing the meta-event finishes this objective instantly; events in its map are worth two points toward completion.",
Complete the Hammerhart Rumble meta-event in Shipwreck Strand.,
"Complete the Hammerhart Rumble Meta-Event, Events in Shipwreck Strand, or Events in Orr",
Complete the Harvest Shore Salmon Run adventure.,
Complete the Heart of Thorns Act I Mastery achievement.,
Complete the Heart of Thorns Act II Mastery achievement.,
Complete the Heart of Thorns Act III Mastery achievement.,
Complete the hide-and-seek minigame on easy.,
Complete the hide-and-seek minigame on hard.,
Complete the hide-and-seek minigame on medium.,
Complete the Highest Gear Jumping Puzzle,
Complete the Highest Gear jumping puzzle in Auric Basin.,
Complete the History Buff achievement to receive the Sea of Sorrows' book.,
Complete the Honor of the Waves story mode to purchase.,
Complete the hunt for the amber keystones and return to Scholar Jieun.,
Complete the Hunter's Journal subcollection.,
Complete the Incursive Investigation: First Recursion achievement and wait until Fractal Incursion's first week ends.,
Complete the Incursive Investigation: First Recursion achievement.,
Complete the Incursive Investigation: Relic in the Mists achievement.,
Complete the Incursive Investigation: Second Recursion achievement and wait until Fractal Incursion's second week ends.,
Complete the Incursive Investigation: Second Recursion achievement.,
Complete the Incursive Investigation: Third Recursion achievement.,
Complete the Inner Nayos Mastery II Achievement,
Complete the Inner Nayos Mastery II achievement.,
Complete the Inner Nayos Mastery III Achievement,
Complete the Inner Nayos Mastery III achievement to purchase.,
Complete the Inner Nayos Mastery III achievement.,
Complete the Inner Nayos: Nyedra Surrounds Savior Achievement,
Complete the Inner Nayos: Nyedra Surrounds Savior achievement.,
Complete the Inquest Facility Race,
"Complete the Into the Spider's Lair meta-event in Inner Nayos, events in Inner Nayos, or events in the Shiverpeak Mountains. Completing the meta-event finishes this objective instantly; events in its map are worth two points toward completion.",
"Complete the Into The Spider's Lair Meta-Event, Events in Inner Nayos, or Events in the Shiverpeak Mountains",
Complete the Jailbreaker achievement to unlock this purchase.,
"Complete the Jailbreaker achievement, then purchase a Proof of Bastion of the Penitent Completion from the raid vendor in the raid lobby.",
Complete the Janthir Syntri Mastery Achievement,
Complete the Janthir Syntri Mastery achievement to purchase.,
Complete the Janthir Syntri Mastery achievement.,
Complete the Janthir Wilds: Godspawn Mastery achievement.,
Complete the Janthiri Treasure Hunter achievement to purchase.,
Complete the Journeykin Outpost Renown Mastery achievement to purchase.,
"Complete the Kaineng Blackout meta-event in New Kaineng City, events in New Kaineng City, or events in the Maguuma Jungle. Completing the meta-event finishes this objective instantly; events in its map are worth two points toward completion.",
Complete the Kinfall Challenge Mode achievement to purchase.,
Complete the Kinfall Fractal,
"Complete the Kinfall fractal five times, or complete the Kinfall fractal in challenge mode one time.",
Complete the Kinfall fractal.,
"Complete the King of the Jungle meta-event in Tangled Depths, events in Tangled Depths, or events in Ascalon. Completing the meta-event finishes this objective instantly; events in its map are worth two points toward completion.",
Complete the Klobjarne Geirr: Janthir Spear Kills achievement to purchase again.,
Complete the Labyrinthine Cliffs Griffon Master adventure.,
Complete the Lonely Tower Fractal,
Complete the Lonely Tower fractal 3 times. A victory in challenge mode completes this objective immediately.,
Complete the Long Way Around minidungeon in Straits of Devastation.,
Complete the Lowland Shore Mastery Achievement,
Complete the Lowland Shore Mastery achievement to purchase.,
Complete the Lowland Shore Mastery achievement.,
Complete the master course!,
"Complete the Master Diver achievement, then return to Dive Master Astora.",
"Complete the Maws of Torment meta-event in the Desolation, events in the Desolation, or events in Kryta. Completing the meta-event finishes this objective instantly; events in its map are worth two points toward completion.",
Complete the meta-event at the Ordnance Corps outpost in Verdant Brink.,
Complete the meta-event at the Teku Nuhoch outpost in Tangled Depths.,
Complete the Mirek Room of the Vasburg Secret Armory.,
Complete the Missing Brood achievement to purchase.,
Complete the Mistburned Barrens Mastery Achievement,
Complete the Mistburned Barrens Mastery achievement and complete this renown heart today to purchase.,
Complete the Mistburned Barrens Mastery achievement to purchase.,
Complete the Mistburned Barrens Mastery achievement.,
Complete the Mistward Legguards collection.,
Complete the Mistward Pauldrons collection.,
Complete the Mistward Plate collection.,
Complete the Mistward Warboots collection.,
Complete the Mistward Warfists collection.,
Complete the Moon Camp Covert Salmon Run.,
Complete the Mount Balrior Convergence,
Complete the Mount Balrior Convergence.,
Complete the Mystic Adventurer achievement to unlock this purchase.,
"Complete the Mystic Adventurer achievement, then purchase a Proof of Mythwright Gambit Completion from the raid vendor in the raid lobby.",
Complete the Naturalist's Journal subcollection.,
Complete the Noble Crash Site meta-event in Verdant Brink while carrying a tiger cub.,
Complete the North Delivery Event,
Complete the Northern Inflammation Reduction,
Complete the Not So Secret jumping puzzle in Gendarran Fields.,
Complete the Obsidian Sanctum Jumping Puzzle in the Obsidian Sanctum Map,
Complete the Obsidian Sanctum jumping puzzle in the Obsidian Sanctum map.,
Complete the Obsidian Sanctum jumping puzzle.,
Complete the Of Mists and Monsters Meta-Event,
Complete the Of Mists and Monsters meta-event in Janthir Syntri.,
"Complete the Of Mists and Monsters meta-event in Janthir, events in Janthir Syntri, or events in Orr. Completing the meta-event finishes this objective instantly; events in its map are worth two points toward completion.",
"Complete the Of Mists and Monsters Meta-Event, Events in Janthir Syntri, or Events in Orr",
Complete the Old Lion's Court raid encounter with challenge mode active.,
Complete the Olmakhan Docks Race,
"Complete the Out of Cluck achievement: While inside the Urban Battleground Fractal, kill all of the chickens in the city.",
Complete the Path of Divinity story achievement.,
Complete the Path of Divinity story chapter.,
Complete the Path of Fire story and the Finding Sibaha collection to train.,
"Complete the Path to Ascension meta-event in the Elon Riverlands, events in the Elon Riverlands, or events in Kryta. Completing the meta-event finishes this objective instantly; events in its map are worth two points toward completion.",
"Complete the Path to Ascension Meta-Event, Events in the Elon Riverlands, or Events in Kryta",
Complete the Performance Enhancement collection.,
Complete the Pilgrim's Rest Renown Mastery achievement to purchase.,
Complete the Precocious Aurene quest.,
Complete the prerequisite to discover this objective.,
Complete the previous objective to reveal the next one.,
Complete the previous objective to reveal this one.,
Complete the previous step to learn more.,
Complete the previous step to reveal.,
Complete the previous step to unlock this one.,
Complete the previous step to unlock.,
Complete the prior step to reveal this step.,
Complete the Priory's History collection.,
Complete the PvP Rush Champion achievement.,
Complete the raid encounter in Skywatch Archipelago.,
Complete the Raid God: Boss Kills achievement to unlock this purchase.,
"Complete the Raid God: Boss Kills achievement, then purchase the a Proof of Raid Boss Mastery from the raid vendor in the raid lobby.",
"Complete the rare collection ""Exaltation of the Guardians"" and purchase from the Primeval Steward in the Tomb of Primeval Kings in the Desert Highlands.",
"Complete the rare collection ""Glorify the Golden Heart"" and purchase from the Primeval Steward in the Tomb of Primeval Kings in the Desert Highlands.",
"Complete the rare collection ""Recitation of the Litany of Deeds"" and purchase from the Primeval Steward in the Tomb of Primeval Kings in the Desert Highlands.",
"Complete the rare collection ""The Collection of Tribute"" and purchase from the Primeval Steward in the Tomb of Primeval Kings in the Desert Highlands.",
"Complete the rare collection ""Walk the Land"" and purchase from the Primeval Steward in the Tomb of Primeval Kings in the Desert Highlands.",
"Complete the rare collection ""Washing the Brow"" and purchase from the Primeval Steward in the Tomb of Primeval Kings in the Desert Highlands.",
Complete the rare collections for each map to restore the Sunspear sanctuary and obtain your mount.,
Complete the Reading Between the Lines or the Scouring the Archive Achievement,
Complete the Reading Between the Lines or the Scouring the Archive achievement.,
Complete the recon run as quickly as possible! Be prepared to perform recon with both sky and ground mounts.,
Complete the related collection achievement in order to unlock purchasing this item.,
Complete the Relics—Secrets of the Obscure Set 1 Achievement,
Complete the Relics—Secrets of the Obscure Set 1 achievement.,
Complete the Retrospective Runaround jumping puzzle in the Silverwastes.,
Complete the Return to End of Dragons achievement.,
Complete the Return to End of Dragons achievements to earn rewards.,
Complete the Return to Heart of Thorns achievement.,
Complete the Return to Heart of Thorns achievements to earn rewards.,
Complete the Return to Icebrood Saga achievement.,
Complete the Return to Janthir Wilds achievement.,
Complete the Return to Janthir Wilds achievements to earn rewards.,
Complete the Return to Path of Fire achievement.,
Complete the Return to Path of Fire achievements to earn rewards.,
Complete the Return to Season 1 achievements to earn rewards!,
Complete the Return to Season 2 achievement.,
Complete the Return to Season 2 achievements to earn rewards.,
Complete the Return to Season 3 achievement.,
Complete the Return to Season 3 achievements to earn rewards.,
Complete the Return to Season 4 achievement.,
Complete the Return to Season 4 achievements to earn rewards.,
Complete the Return to Secrets of the Obscure achievement.,
Complete the Return to Secrets of the Obscure achievements to earn rewards.,
Complete the Return to the Icebrood Saga achievements to earn rewards.,
Complete the Roller Beetle Racing Champion achievement.,
Complete the Ruined City of Arah in Story Mode.,
Complete the Ruined City of Arah story mode to purchase.,
Complete the Ruined City of Arah's explorable paths at least 3 times to purchase.,
Complete the Ruined City of Arah's explorable paths at least 4 times to purchase.,
Complete the Ruined City of Arah's explorable paths at least 5 times to purchase.,
Complete the Ruined City of Arah's explorable paths at least 6 times to purchase.,
Complete the Ruined City of Arah's explorable paths at least 7 times to purchase.,
Complete the Salmon Run that starts near the village shore.,
"Complete the Salmon, Run! achievement to purchase this item.",
Complete the Salvation's Cost Story Chapter,
Complete the Salvation's Cost story chapter to unlock. Only one node may be active in your homestead at a time.,
Complete the Salvation's Cost story chapter.,
Complete the Savior of the Underworld achievement to unlock this purchase.,
"Complete the Savior of the Underworld achievement, then purchase a Proof of Hall of Chains Completion from the raid vendor in the raid lobby.",
Complete the Scholar's Pack collection.,
Complete the Searing Ascent in Draconis Mons.,
Complete the Searing Ascent Jumping Puzzle,
Complete the Searing Ascent jumping puzzle in Draconis Mons.,
Complete the Secluded Tour subcollection.,
Complete the second collection.,
Complete the Secret Lair of the Snowmen raid encounter.,
Complete the Secrets of the Obscure story chapter Sovereign of Nayos to unlock this collection.,
Complete the Secrets of the Obscure story chapter The Eleventh Hour to unlock.,
Complete the Secrets of the Weald Meta-Event,
Complete the Secrets of the Weald meta-event at least once.,
"Complete the Secrets of the Weald meta-event in Castora, events in Starlit Weald, or events in Orr. Completing the meta-event finishes this objective instantly; events in its map are worth two points toward completion.",
"Complete the Secrets of the Weald Meta-Event, Events in Starlit Weald, or Events in Orr",
Complete the Shackles of the Ancients meta-event in Eternity's Garden.,
Complete the Shipwreck Strand Mastery achievement.,
Complete the Shipwreck Strand meta-achievement.,
Complete the Siren's Reef Fractal,
Complete the Skip Up the Volcano Jumping Puzzle,
Complete the Skip Up the Volcano jumping puzzle in Ember Bay.,
Complete the Skyscale Eggs collection.,
Complete the Skyscale Fever collection.,
Complete the Skyscale Flight collection.,
Complete the Skyscale Medicine collection.,
Complete the Skyscale Saddle collection.,
Complete the Skyscale Scales collection.,
Complete the Skyscale Target Practice adventure.,
Complete the Snowball Fight! achievement.(Only available during Wintersday.),
Complete the Snowblind Fractal,
Complete the So It Is Written Story Chapter,
Complete the Solid Ocean Fractal,
Complete the Sorrow's Embrace story mode to purchase.,
Complete the Sounds of the Season achievement.(Only available during Wintersday.),
Complete the South Delivery Event,
Complete the Southern Inflammation Reduction,
Complete the Special Ops Advanced Course 1 achievement to purchase.,
Complete the Special Ops Advanced Course 1 and 2 achievements to purchase.,
Complete the Special Ops Advanced Course 2 achievement to purchase.,
Complete the Special Ops Basic Course 1 achievement to purchase.,
"Complete the Special Ops Basic Course 1, 2, and 3 achievements to purchase.",
Complete the Special Ops Basic Course 2 achievement to purchase.,
Complete the Special Ops Basic Course 3 achievement to purchase.,
Complete the Special Ops Final Course achievement to purchase.,
Complete the Spirit of the Tiger achievement and unlock this mini in your wardrobe.,
Complete the Spirit Vestibule Minidungeon in Seitung Province,
Complete the Spirit Vestibule minidungeon in Seitung Province.,
Complete the Starlit Weald Mastery achievement.,
Complete the Starlit Weald Mastery meta-achievement.,
Complete the Starlit Weald meta-event.,
Complete the Statue of Death and Resurrection event.,
Complete the Story Chapter A Race to Arms,
Complete the Story Chapter Coming Home,
Complete the Story Chapter Eventide's March,
Complete the story chapter Eventide's March.,
Complete the Story Chapter Heitor's Gate,
Complete the story chapter Heitor's Gate.,
Complete the story chapter Home Sweet Home.,
Complete the Story Chapter Penance for the Past,
Complete the story chapter Penance for the Past.,
Complete the Story Chapter Sorrow in These Halls,
Complete the story chapter Sorrow in These Halls.,
Complete the Story Chapter Sovereign of Nayos,
Complete the story chapter Sovereign of Nayos.,
Complete the story chapter The Invitation.,
Complete the Story Chapter Treachery,
"Complete the story step ""Buried Insight.""",
"Complete the story step ""Forging the Pact.""",
"Complete the story step ""Heart of Thorns.""",
"Complete the story step ""Prized Possessions.""",
"Complete the story step ""Strange Observations.""",
"Complete the story step ""The Battle of Fort Trinity.""",
"Complete the story step ""The Source of Orr.""",
Complete the story step Heart of the Volcano.,
Complete the story step Strangers among Lands.,
Complete the story to unlock this skill.,
Complete the Sunken Treasure Hunter achievement.,
Complete the Swampland Fractal,
Complete the Tales of the Lowland Wisps collection to acquire this mini.,
Complete the task region to acquire cold-resistant eggshells.,
Complete the task region to get a grawl firestone.,
Complete the Temple of Febe raid encounter 3 times. A victory in challenge mode will complete this objective immediately.,
Complete the Temple of Febe raid encounter.,
Complete the These Cursed Halls achievement in Eternity's Garden.,
Complete the third story chapter of Guild Wars 2: Janthir Wilds to unlock this feature.,
Complete the Tier 2 Legendary Armor: Suffused Obsidian achievement to purchase another runestone of suffusion.,
Complete the Tiger Training Guide subcollection.,
Complete the Titan Terminus achievement to purchase this item if you need a replacement.,
Complete the Toy Quality Control achievement.(Only available during Wintersday.),
Complete the Turtle Unlock: Getting Stronger achievement.,
Complete the Turtle Unlock: Starting Small achievement.,
Complete the Turtle Unlock: Suiting Up achievement.,
Complete the Twilight Arbor story mode to purchase.,
Complete the Twilight Oasis Fractal,
Complete the Uncategorized Fractal,
Complete the Underground Facility Fractal,
Complete the Unintended Coursework achievement.,
Complete the Unknown Nightmares: Experiments in the Shadows Achievement,
Complete the Unknown Nightmares: Experiments in the Shadows achievement.,
"Complete the Unlocking the Wizard's Tower meta-event in Skywatch Archipelago, events in Skywatch Archipelago, or events in the Shiverpeak Mountains. Completing the meta-event finishes this objective instantly; events in its map are worth two points toward completion.",
Complete the Unlocking the Wizard's Tower meta-event in Skywatch Archipelago.,
Complete the Urban Battleground Fractal,
Complete the Vexa's Lab Minidungeon in Fireheart Rise,
Complete the Vigil's Honor collection.,
Complete the Visions of Dragonfall collection.,
Complete the Visions of Istan collection.,
Complete the Visions of Jahai collection.,
Complete the Visions of Kourna collection.,
Complete the Visions of Sandswept Isles collection.,
Complete the Visions of Thunderhead Peaks collection.,
Complete the Volcanic Fractal,
Complete the Wayfind Yourself Out achievement to purchase.,
Complete the weekly Dragon Bash Festivities achievement to earn special prizes.,
Complete the weekly Four Winds Festivities achievement to earn special prizes.,
Complete the weekly Halloween Festivities achievement to earn special prizes.,
Complete the weekly Lunar Festivities achievement to earn special prizes.,
Complete the weekly Super Replay achievement to earn special prizes.,
Complete the weekly Wintersday Festivities achievement to earn special prizes.,
Complete the What Lies Within meta-achievement to purchase.,
"Complete the What Was Before, Missing Brood, or Tyrian Taste Testing Achievement",
"Complete the What Was Before, Missing Brood, or Tyrian Taste Testing achievement.",
Complete the Whiffing Wanderer and Wanderer Weaving achievements to purchase.,
Complete the Whisper's Secret collection.,
Complete the Wind through the Walls Jumping Puzzle,
Complete the Wind through the Walls jumping puzzle in New Kaineng City.,
Complete the Wintersday Gauntlet achievement.(Only available during Wintersday.),
Complete the World Boss Rush Champion achievement.,
Complete the WvW Rush Champion achievement.,
Complete the Zojja's Journal: Devastated Garenhoff achievement.,
Complete the Zojja's Journal: Droknar's Light achievement.,
Complete the Zojja's Journal: Jade Mech Habitation Zone 03 achievement.,
Complete the Zojja's Journal: Primal Maguuma achievement.,
Complete the Zojja's Journal: Rata Novus Promenade achievement.,
Complete the Zojja's Journal: Skyward Marches achievement.,
Complete this book by recording the three Hylek Alchemy Chapters in your Hylek Alchemy Apprentice Tome by passing each of Atlalli's tests with the tome in your inventory.,
Complete this episode to unlock rewards and achievements.,
Complete Tier 1 of an Artisan of Arms Achievement,
Complete tier 1 of an Artisan of Arms achievement by landing deathblows on 100 enemies with your profession's new weapon.,
Complete Twilight Arbor in Story Mode.,
"Complete Unlocking the Wizard's Tower Meta-Event, Events in Skywatch Archipelago, or Events in the Shiverpeak Mountains",
Complete various challenges in WvW.,
"Complete World 1, Zone 1 in Exploration Mode.",
"Complete World 1, Zone 2 in Exploration Mode.",
"Complete World 1, Zone 3 in Exploration Mode.",
"Complete World 2, Zone 1 in Exploration Mode.",
"Complete World 2, Zone 1 without angering any hillbillies.",
"Complete World 2, Zone 2 in Exploration Mode.",
"Complete World 2, Zone 3 in Exploration Mode.",
"Complete World 2, Zone 3 without being frozen by a banana.",
Complete World 3 Test Zone 2.,
Complete World vs. World Rush achievements in WvW to earn bonus rewards. Call of the Mists boosts WvW rewards during the event.,
Complete your profession's elite specialization collection and complete the Harvest Temple strike one time to unlock.,
Complete your profession's elite specialization collection and complete the Harvest Temple strike two times to unlock.,
"Completed ""The Dragon's Reach, Part 2""",
Completed %num1% Total Fishing Collections,
Completed %num1%/%num2%,
Completed %num1%/%num2% Achievement[s],
Completed %num1%/%num2% Achievements,
"Completed %num1%/%num2% Activity[pl:""Activities""]",
Completed %num1%/%num2% Annual Lunar New Year Achievements,
Completed %num1%/%num2% Annual Super Adventure Box Achievements,
Completed %num1%/%num2% Annual Wintersday Achievements,
Completed %num1%/%num2% Bell Choir Songs,
Completed %num1%/%num2% Black Lion Stolen Goods Recovery Event Achievements,
Completed %num1%/%num2% Boss Blitz Meta-Events,
Completed %num1%/%num2% Bounties,
Completed %num1%/%num2% Choya Daily Grinds,
Completed %num1%/%num2% Choya-Powered Fractals,
Completed %num1%/%num2% Collections,
Completed %num1%/%num2% Combat Challenges,
Completed %num1%/%num2% Daily Grinds,
Completed %num1%/%num2% Domain of Istan Bounties,
Completed %num1%/%num2% Door Events,
Completed %num1%/%num2% Events,
Completed %num1%/%num2% Events in Caledon Forest,
Completed %num1%/%num2% Events in Metrica Province,
Completed %num1%/%num2% Events in Queensdale,
Completed %num1%/%num2% Events in the Super Adventure Box Ooze Kitchen,
Completed %num1%/%num2% Events in Wayfarer Foothills,
Completed %num1%/%num2% Fashion Daily Grinds,
Completed %num1%/%num2% Feats<br>in World 1 in Exploration Mode,
Completed %num1%/%num2% Feats<br>in World 2 in Exploration Mode,
Completed %num1%/%num2% Fractals,
"Completed %num1%/%num2% Gnashbash ""Birthday"" Celebration Achievements",
Completed %num1%/%num2% Lap[s],
Completed %num1%/%num2% Laps,
Completed %num1%/%num2% Laps within the Time Limit,
"Completed %num1%/%num2% Match[pl:""Matches""]",
Completed %num1%/%num2% Quickplay Raid Encounters,
Completed %num1%/%num2% Quickplay Raids,
Completed %num1%/%num2% Renown Hearts,
Completed %num1%/%num2% Requisition Missions,
Completed %num1%/%num2% Rounds of Toypocalypse,
Completed %num1%/%num2% Steps,
Completed %num1%/%num2% Steps to Break Sidony's Curse,
Completed %num1%/%num2% Tall Orders,
Completed %num1%/%num2% Vision Quests,
Completed %num1%/%num2% Zone[s],
Completed %num1%/%num2% Zones in World 1's Exploration Mode,
Completed %num1%/%num2% Zones in World 2's Exploration Mode,
Completed %str1%,
Completed a %str1%.,
Completed A Bold Strategy,
Completed a Tier %num1% %str1%.,
Completed All Festival of the Four Winds Achievements,
Completed Cave of the Sunspear Champion,
Completed Divitium Nava,
Completed events,
Completed every room in the Valdhertz Crypts.,
Completed Eye of the Brandstorm,
Completed From the Ashes,
Completed Legacy,
Completed Lunar New Year Customs (Annual),
Completed mission %str1%,
Completed Saddle[s],
Completed Super Adventure Box Nostalgia (Annual),
Completed the first chapter of your journey to the legendary backpack Ad Infinitum.,
Completed the first chapter of your journey to the legendary pistol HOPE.,
Completed the penultimate chapter of your journey to the legendary backpack Ad Infinitum.,
Completed the penultimate chapter of your journey to the legendary pistol HOPE.,
Completed the Race Course %num1%/%num2% Time[s],
Completed the second chapter of your journey to the legendary backpack Ad Infinitum.,
Completed the second chapter of your journey to the legendary pistol HOPE.,
Completed the Valdhertz Crypts Armory.,
Completed Winter Wonderland %num1%/%num2% Times,
Completed wood division the previous week.,
Completed World 3 Test Zone 1,
Completed!,
Completed: %str1%,
Completely unlock the elite specialization.,
Completing the final chapter of your legendary journey.,
Completing the first chapter of your journey to the legendary axe Frostfang.,
"Completing the first chapter of your journey to the legendary axe, Astralaria.",
Completing the first chapter of your journey to the legendary dagger Incinerator.,
Completing the first chapter of your journey to the legendary focus The Minstrel.,
Completing the first chapter of your journey to the legendary greatsword Sunrise.,
