english,translate
The Ringmaster used a hypnotic device like this one to brainwash circus audiences in Divinity's Reach.,
"The rise of Kalla Scorchrazor gave hope to the oppressed legions of the charr, but simply hearing words of promise on the wind did little to end their suffering. The Flame Legion was notorious for snuffing out insurgents to their rule, and our forebears feared this would be Kalla's ultimate fate as well.While we would later come to learn of her victory on the Plains of Golghein, the first of those who would become the Olmakhan took Kalla's words to heart and chose to rebel in their own way: to flee the charr society that oppressed them so cruelly.The Olmakhan, then a mere warband like any other, left our ancestral homeland. Flame Legion loyalists and humans both sought to destroy us, with no quarter given by either side.Finally unbound by the Flame Legion's harsh dictums, the warband that would one day be Olmakhan brought together our charr brothers and sisters. They were free to use their magic, to teach and learn without fear. It was this magic that helped deter our pursuers, which allowed us passage out of Ascalon.Our forebears followed the eastern edge of the Shiverpeak range southward, keeping to rocky, inhospitable terrain. The harder it was for us to travel, the harder it was for our foes to give chase.This was no simple flight, of course. Our warband had many to its name, young and old alike. It was slow going for many years, picking our way through a landscape most treacherous. As we went from the frigid peaks of the Shiverpeaks to the searing sands of the Crystal Desert, our warband was forged into something new. Something we hadn't expected. No longer were we a band of warriors. We were more than that; a tribe of our own.Where once a legionnaire would give orders, the eldest and most experienced came to offer their advice together. Our council was born on the long five-year trek to our new home, our rule of law and governance. For as long as we have borne the name ""Olmakhan"" have we been led by a council of five.We traveled south until we reached the sea, its surface a glittering mirror reflecting the calm skies above. It was a sign, we knew, that our long journey had finally reached its end. The Olmakhan would live in this place, one with the world around it. Not seeking to dominate nor seeking to control.Nature favor us and our great undertaking.",
The Rise of Reiko Murakami,
The roads to Black Haven are much safer since you took care of the bandits in the area. Thank you. Your help has made a world of difference. —Lionguard Micah,
"The rogue shaman Arderus is sought for his potential usefulness as an intelligence asset. Last sighted near the burning forest, though he could have moved on by now. Target has many area allies.",
The Roller Beetle,
The rope attached to the supplies snapped due to overstretching.,
The rope is almost through your fingers. Don't lose it.,
The rope snapped due to overstretching.,
"The ropes tethering your supply crate are starting to fray.If you reach four stacks of this effect, the ropes will break, and the crate will be detatched.This effect diminishes if you allow your crate to catch up to you.",
"The rugged uplands of the Steamspur Mountains are overshadowed by the power of a singular great mountain. This is the wildest of lands, far from the prying eyes of the races of Tyria.",
The Ruined City of Arah Dungeon Track,
The Ruined City of Arah Story,
The Ruined City of ArahStory recommended level: <c=#CC9900>80</c>Explorable recommended level: <c=#CC9900>80</c>,
The Ruins of Fort Salma,
The saboteurs poisoned all the scarecrows in the fields.,
The saboteurs were thwarted from poisoning all the scarecrows in the fields.,
The sacrifices of the norn's greatest heroes spills out of their Steadings giving Karma to us all.,
The Sad End of Ascalon's Heroes,
The Sad End of Kendrick Redstaff,
The Sad End of Siegemaster Lormar,
The Salmon Run race is about to begin!,
The sandstorm will dissipate in: %str1%,
The sapper is preventing the crystal from charging!,
The saurian nests must also be kept warm to ensure another generation survives. Any hay you can bring would be helpful.,
The Save Woodland Creatures adventure is over here.,
The scanner does not respond.,
The SCAR lane cannon is nearly lost!,
The SCAR lane cannon is taking heavy damage!,
"The scholars of the Durmand Priory search for ancient lore of the dragons, and research possible weaknesses. Zhaitan's attack threatens the heart of the Order. Hopefully, you will arrive before all is lost.",
The Schoolmasters,
The Scorch warband thanks you for your aid.,
The Scourge of Vabbi allows no defeat! Awakened forces redouble their effort.,
The Scream,
"The scribal workshop is one of the main buildings you can build in your guild hall. The workshop allows members of your guild to train as scribes, who are able to craft guild-specific items for your guild to use. Kensho, the proprietor of the workshop, offers upgrades related to resource harvesting and crafting.",
The Scrying Pool,
"The sea beckons to us all, yet only a handful of enterprising privateers have managed to turn it into a successful career. What separates these seafaring scalawags from an everyday landlubber like you?With this book in your hands? NOTHING!Even if you can't tie a knot to save your life, even if you think ""port"" is just a fancy wine, and even if the mere thought of standing on a boat makes you queasy, this step-by-step guide will give you the tools to transform yourself into a hardened corsair.Learn the following vital skills to grow your sea legs:The basics of swordplay, complete with gorgeously rendered illustrations.Surviving on a desert island in the event of marooning.Three valuable tricks to identifying suspect grog.How to spot mutinous crew members.And much, much more!",
The Searing,
The second checkpoint brazier has been lit.,
The second floor of the Tower of Nightmares has opened.,
The second path is now active for you. Please navigate to the orbs at the end of each path.,
The second PvP Ladder Test Season is underway! Compete for glory and prizes in the Mists!Learn more here.,
The secrets to crafting a quality hylek poison can be found among the alchemy supplies hidden in the treasure room of the Tears of Itlaocol in Caledon Forest.,
"The seers imbued the natural denizens of Castora with great power and set them to guard their sacred island. Confront Kela, Seneschal of Waves, and drive her off to help secure the coast.",
"The seers, unable to resist an opportunity for symbolism, had bound Pax and Bellum to the aetheric anchor with a clear message in mind: peace and war were born together, and one is never far from the other.",
The selected world is already your home.,
The Sentient Abberation appears stable now.,
The Sentient Anomaly appears stable now.,
The Sentient Oddity appears stable now.,
The sentient singularity appears stable now.,
The Sentinels appreciate your hard work.,
The Sentinels appreciate your support.,
The Sentinels at Kinar Fort thank you for your support.,
The Sentinels thank you for the assistance.,
The Separatists won't soon forget your name. You've done a service for the charr.,
The Seraph appreciate your help.,
The Seraph are attempting to retake New Loamhurst!,
The Seraph are attempting to retake Saidra's Haven!,
The Seraph are attempting to retake the Harvest Cascades!,
"The Seraph are the protectors of Kryta, the hands of the queen. You are fortunate to have Logan Thackeray, one of their most renowned captains, as your friend.",
The Seraph forces have successfully regrouped.,
"The Seraph have been rescued, and the bandits have been stopped.",
The Seraph have retaken New Loamhurst!,
The Seraph have retaken Saidra's Haven!,
The Seraph have retaken the Harvest Cascades!,
"The Seraph of Nightguard Beach have their camp up and running smoothly. They send their thanks. That said, I do know of someone else who could use your help. If you haven't already spoken with her, Bryn Tailor has been keeping an eye on things to the east, near Shieldbluff Point. Please, lend her a hand.—Lieutenant Summers",
"The Seraph protect Kryta, and although I didn't join, I had the honor of training with their best soldiers.",
The Seraph successfully defended New Loamhurst!,
The Seraph successfully defended Saidra's Haven!,
The Seraph successfully defended the Harvest Cascades!,
The Seraph thank you for the assistance you provided Fort Salma.,
The Seraph thank you for your help in Greyhoof Meadows.,
"The server was unable to authenticate your gameplay privileges. Please contact Customer Support to provide them with your registered e-mail address. For additional support, please visit <a=1>http://support.guildwars2.com</a>.",
The server you are attempting to join is password protected. Please enter the password below.,
The settlements of Southsun Cove are under attack! All hands are requested to assist in their defense.,
The Shadow Behemoth,
The shadowstone is unresponsive.,
The Shaemoor Garrison Seraph are grateful for your efforts.,
The Shattered<br>Keep,
The Shatterer is summoning Pulsing Crystal Nodes to regenerate! Move to destroy them!,
The shield around the artifact has disappeared.,
The shield bubble skill now also heals nearby allies,
The shield has been removed.,
The shield relic is already being interacted with.,
"The Shining Blade has identified a promising lead on the fate of your parents. After so many years and so many questions, it would certainly be a relief to finally know the truth.",
The Shining Blade thanks you.,
The shipping manifests you found show Alden Wamser moving large sums of money. Interview him.,
The shrines are at full power. There is a surplus of grid energy!,
The shrines have lost power!,
The siege carrier has granted boons to all allies instead!,
The Siege Turtle,
The Silverwastes: This one landed right on the SS Topsy-Turvy. Recover it before the skritt find it!,
"The site of an ancient battle in Echovald Wilds might be worth investigating, if you can get in.",
"The situation in the Garenhoff fractal progressed rapidly. Within a few minutes of the tower's destruction, the elementals in the town had become completely unbound and began attacking the citizens. Within a few hours, the released magic coalesced into a powerful storm that hovers over the area. Fear has spread rapidly through the populace as well, adding a possible vector for incursions.Conclusion: As suspected, the loss of the tower has immediate catastrophic local effects, in addition to the obvious long-term risks for Tyria as a whole. Protection of the tower should remain a critical priority. We recommend running other experiments on other potential scenarios related to the tower's safety to help build a robust set of contingencies for all possible threats.",
"The situation in the Kaineng fractal has deteriorated rapidly. The jade mechs were designed to keep the city clean and productive, and once they achieved sentience they quickly optimized for that, determining that organic life was the primary impediment to that goal. When their initial command that organics leave the city was not obeyed, violence became their prompt solution. Their takeover of the city is already nearly complete, and the possibility remains that they will desire to expand their control.Conclusion: This kind of machine intelligence being developed remains a significant concern for Tyria, and it raises the troubling possibility that similar constructs might already exist outside of Tyria. We recommend continuing to study scenarios like this until a better prevention plan is developed.",
"The situation in the Kryta fractal has developed in an unanticipated direction. While the emergence of Thackeray as the nation's leader after the deaths of the royal family was unsurprising, the deterioration of Krytan society was unexpected. His attempts to prevent more incidents have led to increasingly draconian measures, scaling back centuries of freedom in the country.Conclusion: This experiment has reinforced the unpredictability of the nations of Tyria and the corruptible nature of even the noblest people involved. We recommend additional study, but we advise against any Astral Ward involvement in Tyrian politics for the foreseeable future.",
The Six: Being or Playing God,
The skies have cleared.,
The skies have cleared. Treacherous weather has subsided...for now.,
The skiff race is about to begin!,
The Skimmer,
The Skimmer-Net Scramble adventure is now available. Speak with Castaway Kae on the southeast edge of Jetsam Point to participate.,
The skimmers native to Castora are a staple of both the island's ecology and the castaways who eke out survival along the coastal waters.,
"The skimmers need to be fed after all this travel. There's plenty of food around, but someone has to actually gather it.",
The skritt are grateful for your help.,
The skritt are marshaling at the Eye of the North. Earn skritt support marks to purchase rewards and contribute towards bonus rewards!,
"The skritt have prepared a massive bomb to take down the destroyer queen. If Ftokchak's plan works, the queen will be destroyed. If it fails, all of us are going to be buried under a massive landslide. Well, you can't say the life of an Order operative is boring...",
The skritt king's royal Wintersday decree only applies to Brisban Wildlands!,
The skritt of Arcallion Digs respect you now.,
"The skritt of Ratatosk are now safer, thanks to you.",
The Skyscale,
The skyscale has been separated from you and has become lost. Avoid traveling large distances at once to allow it to keep up.,
The Skyscale Target Practice adventure is now available. Speak with the skyscale trainer on the northeast edge of the Wizard's Tower to participate.,
The skyscale will not carry you off the island.,
"The skyscale's Blast skill, [lbracket]%str1%[rbracket], can be used to engage enemies. While on land, leap into the air and breathe fire ahead of you. While in the air, descend toward the ground before attacking.",
The Skysplitter has begun firing!,
The Skysplitter lacks power.,
"The slavers have been stopped, and the servants are free.",
The Sleeping Seed (Infused),
"The Snaff Prize competition is underway—the most presitgious title an inventor can earn—so where are you? The College of Statics is counting on us, and we can't demonstrate the mind-blowing genius of our Very Old Energy Detector if you're not with us to hold up your end. We're a krewe, a team, and each krewe member has a part to play. Get your ears over to the parade grounds near Obscura Incline, on the double!—Pokka, Genius",
The Sniper,
The sniper has been successfully broken out of their attack. Use the nearby teleporter to return to the fight!,
The sniper is charging a deadly attack. Break them or face certain death.,
The sniper is charging a deadly attack. Prepare to block or reflect.,
The Snow Leopard shrine has been restored. Good job!,
The soldiers at Seraph Protectors are grateful for your help.,
"The Sons of Svanir are hunting one of the Spirits of the Wild. If the Spirit of Minotaur has indeed manifested in the physical world, it will take great cunning to track it.",
"The Sons of Svanir are norn who worship a spirit they call ""Dragon."" They pride themselves on being the toughest, smartest predators in the world.",
"The Sons of Svanir are using the jotun leader Korag's obsession for power to lure him into worshipping the ice dragon, Jormag. Jormag exacts a heavy price from its worshippers, however, and many jotun will be ravaged if Korag isn't turned from his current path.",
The Sons of Svanir are weakened because of you.,
"The Sons of Svanir gained access to the Mists and used it to attack Wolf Havroun Solvi and his apprentice, Valda. Only a havroun can physically transport others into the Mists, so it will take a havroun's help to confront the Sons of Svanir there.",
"The Sons of Svanir have corrupted a powerful alpha wolf known as Ormi. While Ormi's spirit remains captive and tortured, Wolf mourns the mutilation of his brother, and will bless anyone who ends Ormi's suffering.",
The Sons of Svanir have invaded the damaged kodan sanctuary ship in order to earn Jormag's favor.,
The Sons of Svanir have invaded the damaged Kodan's sanctuary ship in order to earn Jormag's favor.,
"The Sons of Svanir revere the ice dragon Jormag like other norn revere the Spirits of the Wild. They named themselves after Svanir, a norn hunter who embraced the ice dragon as his spirit totem. Svanir's sister, Jora, was instrumental in his death, so the Sons of Svanir disdain all females.",
"The Sons of Svanir successfully invaded the Mists, but nobody knows how or why. Bear Havroun Grechen is in the best position to help confront them and solve this mystery. She was last seen heading for Breakneck Pass.",
The Sorrow's Embrace explorable mode is now available. Remind those dredge who's boss! (The story version must be completed first.),
The sounds of frequent explosions caused by the Separatists is hard on the ears. You certainly made dealing with them easier for us. And given us some momentary peace. I'm glad you're on our side. — Tiga Fierceblade,
The south excavation device has been secured.,
The south lung has fallen. Macrophage resurrection halted.,
The southern beacon is supercharged! Hand in your remaining emotional residue.,
The southern organ has been rendered inoperable!,
The southern organ is vulnerable.,
The southern sectors can now be retaken!,
The Southsun Rose (Infused),
"The southwest and northwest drills are under attack! If either is destroyed, the system will shut down.",
The southwest drill has sustained notable damage. Destruction will result in system shutdown.,
The southwest drill has sustained significant damage. Destruction will result in system shutdown.,
The Sower's Almanac,
The Speakers Headquarters,
The Speakers outpost has been recaptured.,
The Spearmarshal's Gift[s],
The spectral agony survey has failed. Rhianwyn's team is returning to camp.,
The spice that makes everything worthwhile.,
The spider has captured a player. Break the spider's defiance bar to free the player!,
The spider will return to its lair in: %str1%,
The spikenose beetle charges its foes when enraged.,
"The spirit axe is a powerful Norn weapon, forged with materials so powerful that it can damage creatures immune to normal weapons.",
The Spirit Vale,
The Spirit Vale is quiet.,
"The spirits are at rest, but the White Mantle are in high number. Beware.",
The spirits banished you.,
The spirits have been angered. Run!,
The spirits have retreated for now.,
The Spirits of the Wild[s],
The spirits' blessings protect you here.,
The Splintered Coast shores are calm.,
The Splintered Coast shores are disturbed by Tequatl's lingering presence.,
The spotted beetle releases noxious gas in order to disorient enemies.,
The Springer,
"The springer is capable of jumping high into the air. Hold [lbracket]%str1%[rbracket] to charge the jump, and release it to launch.",
"The stag has been leading you on a merry chase, but now you have an ally. Perhaps this time, the stag will fall into your trap.",
"The stag leads you on a merry chase, but now you have an ally. Perhaps this time, the stag will fall into your trap.",
The stage at the Crow's Nest awaits.,
The star glows too bright to improve any more today.,
The stash requires a technomagical detector to open.,
The steam creatures are contained to the frozen lake.,
The steam creatures are expanding their territory.,
The steward can't access that location.,
The steward is done fixing terminals today.,
The Sting of Gargantula,
The stone here has worn down over decades. It is clear that many were buried here. It is more monument than grave.,
The storm is clearing and Koda's Flame burns brighter than ever. Use it to find treasures frozen in the ice.,
"The storm is clearing, but Koda's Flame was nearly extinguished.",
The Stormpiercer Spear Skin[s],
The Story of Priest Hehmnut,
The Story of Priest Kahdat,
The Story of Priest Nahtem,
"The story of the Olmakhan begins with the charr of old, for there was once a time when we were no different. The first Olmakhan were not born into our family, but instead chose it for themselves.Our first benefactors and elders were born and raised as all charr are: to parents uncaring, a fahrar unbending, a warband unyielding. Raised to fight, to kill, to win. But even these savage souls knew kinship to one another, loyalty beyond oneself, and an appreciation for the good of the many over the individual. It was the warband that mattered, not any one soldier. In fact, to be without a warband—the closest thing they knew to a family—was to know shameful isolation.For the earliest of those who would be Olmakhan, the Flame Legion ruled over Blood, Iron, and Ash. They were ruthless beyond comprehension, driven by an insatiable lust for power over all living things. It was Flame Legion will that prevented mothers and daughters of the charr from taking up arms or practicing magic, for the shamans rightly feared they would be their downfall. Even though these mothers and daughters could control the sky itself, they were shunned by the Flame Legion as inferior to the fathers and sons on the battlefield. Bathea Havocbringer, martyr to all sensible charr, was the first to see through their lies. She would certainly not be the last. For many generations, there was an imbalance in charr society. The Flame Legion would blame the humans, but to any with eyes it was clear that our people had become their own worst enemy. In the absence of humanity, the charr would continue to fight. Their entire worldview was constructed around domination and warfare. There would always be another foe, always another enemy to overcome, until they were at each others' throats and none were left alive.For years, our benefactors despaired. How would we escape from this endless cycle of death and destruction?Then the stories began to spread. Stories of rebellion.Pyre Fierceshot was a name long whispered in hushed tones, for fear the Flame Legion's ears might hear it. He had worked with the humans to save our world, to stop the Flame Legion's false gods from destroying all we held dear.Blood, Ash, and Iron began to draw closer to one another. An alliance was finally beginning to take shape, but the suspicions of the past were not easily overcome. Hesitation bred complacency in the ranks, and the Flame Legion found them easy prey. For many years, we would hear of revolution. We would hear that the battle for freedom was coming. For a time, there would be a flicker of hope. Then the Flame Legion would gather their forces and destroy it.It was in this time of great unease, when it seemed the Flame Legion's influence would burn away all remaining hope, that we began to hear the words of Kalla Scorchrazor, grandcub of the famed Fierceshot.Within her words were the very ideas the Flame Legion sought to purge. Freedom for the mothers and daughters of the charr. An alliance between Blood, Ash, and Iron. Only through the destruction of the old ways could our kind ever be free.Some charr took this as a sign to stand and fight. But our forebears had seen this again and again. Fighting begets fights, violence begets violence. The cycle anew.And so, those who would one day become Olmakhan fled the ancestral charr lands. They fled from Ascalon. They fled from the legions. They fled from the Flame.",
The story of your character in the world of Tyria.,
The Straits of Devastation separate the Tyrian mainland from the dragon-corrupted wasteland that once was the human nation of Orr.,
The strength of Dhuum's influence is overwhelming beyond this point. Your soul will be crushed.,
The Study and Implementation of Consciousness Transferal,
The sun will display rays of light when looked at directly.,
The Sunspear Creed,
The Sunspear Creed: On a book stand.,
The Sunspear raid on Palawadan is imminent.,
The Super Adventure Begins!,
The Super Adventure Box is off-line for maintenance.,
The super adventure forges onward! The test world seems to have a deeper level—what fun new adventures can be discovered within?,
The Super Adventure Returns!,
The supplies weren't delivered in time.,
"The supplies you were carrying were destroyed by Kryptis turret fire. Avoid damage from Kryptis blasters, drainers, and sentinels to get the supplies to Vethrax.",
"The surges of ley-line energy have been increasing. They're concentrating into new and more dangerous forms. These anomalies don't appear to be hostile, but their presence is causing a lot of damage. We can't let them continue this destruction. I have something for you that could help. Come see me as soon as you can.—Ela Makkay",
The sylvari fugitive Canach has gone into hiding. Adventurers are needed on Southsun to smoke him out.,
"The tablet is marked with symbols you don't recognize. Scratches and circles defy your attempts to comprehend them. However, there are also diagrams of what appear to be weapons, showing their use in ways you've never seen before.",
"The tablet seems to have writing on it, but it's too faint to make out.",
The Tangle Root mountain passes are free of the jungle's corruption.,
The tank is full. Use the Sanguine Shot skill to weaponize the blood.,
The tank's exposed!,
The tank's exposed! You can now use any of your attack skills to finish it off!,
