english,translate
The Only Way Season,
The opposing guild is busy in a match. Please wait.,
The opposing team quit. Match canceled.,
The Orb Cavern,
The orb detected movement.,
The orb is hidden nearby. Go find it.,
The orb returned to its original position.,
The orb split into 3. They are nearby. Collect them before time runs out!,
The orb split into six orbs. Gather them all.,
The orb split. Gather all of the fragmented orbs.,
The Order has seen the darkness that threatens Tyria.,
The Order of Om,
The Order of Om's masters are spread throughout Tyria.,
The Order of Shadows have a secret cave base in the Darklands where we plan our effort. You can also find services there.,
The Order of the Crystal Bloom has begun to disrupt the central Brandstorm.,
The Order of the Crystal Bloom has collected enough Eternal Embers for the next phase of the battle.,
"The Order of Whispers and their allies encountered hardship in Tangled Depths, but their plan proceeds to blast a hole into Dragon's Stand.",
The Order of Whispers and their allies established a good position to blast into Dragon's Stand before the chak gerent emerged.,
The Order of Whispers and their allies fought valiantly against the chak gerent and were able to open a path into Dragon's Stand!,
The Order of Whispers and their allies gained some ground and enacted their plan to blast into Dragon's Stand before the chak gerent emerged.,
"The Order of Whispers and their allies gained some ground. Their position may not be ideal, but it's time to enact their plan to blast into Dragon's Stand.",
The Order of Whispers and their allies made little progress at punching a hole into Dragon's Stand and were outmatched by the chak gerent.,
"The Order of Whispers and their allies managed to carve out a small foothold , but their fight to get past the chak gerent into Dragon's Stand was difficult.",
The Order of Whispers and their allies managed to carve out a small foothold in Tangled Depths. Now progress must be made to blast a hole into Dragon's Stand.,
The Order of Whispers and their allies were able to slow the chak gerent but were soon overwhelmed. The plan to blast into Dragon's Stand has failed.,
"The Order of Whispers and their allies were able to slow the chak gerent, but it wasn't enough and the plan to blast into Dragon's Stand has failed.",
"The Order of Whispers and their allies were very successful in the Tangled Depths! Bolstered by their success, the time has come to blast into Dragon's Stand and take this fight to Mordremoth.",
The Order of Whispers appreciates your help.,
"The Order of Whispers has a field operation that requires your assistance. Agents have identified a number of crises brewing across Tyria. We need to cut off those threats before they destabilize the area.Pay attention to the intel for hot-spot locations, and then handle those events as they occur. You're welcome to any spoils you find, of course, and the order will also be issuing bounties based on the danger posed.—HSPS: This message won't self-destruct, but you'll burn it yourself if you know what's good for you.",
"The Order of Whispers has a plan to access Professor Gorr's lab, but before you can sneak into Gorr's lab, you need to sneak into Councillor Flax's office and acquire the raw materials for a convincing forgery.",
The Order of Whispers is standing by to help you rescue Professor Gorr from the Arcane Eye. Now you'll see if Rakt's secret police force is better at keeping a secret than the Order of Whispers is at discovering one.,
The Order's plan is unfolding smoothly thanks to your efforts.,
"The orders of Tyria—the Vigil, the Durmand Priory, and the Order of Whispers—are looking for dangerous magical amulets like the one your old warband mate, Howl the Brazen, wore when he was alive. The orders await you at Howl's grave to examine his amulet and determine what they're up against.",
"The ore we got out of those dredge mines has been a lifesaver. Hopefully, they'll think twice before they attack us again. Best regards. —Surveyor Falki",
The Original Four,
The Origins of Madness: Clashes,
The Origins of Madness: Regroup,
The Origins of Madness: Reporting In,
The Origins of Madness: Scarlet's Twisted Marionette,
The Orrian mesmer discarded this battered greatsword when she relinquished the form of Tactician Syska.,
"The Orrian sculptor Malchor is understood to have designed the statues of the human pantheon found in most sites of worship, although evidence suggests Grenth's representation may have been the work of an anonymous later artist. Only Dwayna's statues were significantly transformed by Zhaitan's corruption; one possible explanation is that Malchor's spirit—which has unusual influence over the statues near his place of death—might have provided a conduit.    Zhaitan's emotional motivations remain impenetrable, but it may also have chosen to single out symbols of life worship for corruption, much as it warped the religious beliefs of Risen temple leaders.",
The other defilers in the area grow stronger with the death of their comrade.,
"The others still won't see what's right in front of their faces: those cities we see floating out there are there for a reason. We need allies against the traitors, and now we've been given them—hundreds of them—delivered right to our home! But instead they want to just cower and wait for the end.    Well, I won't! I'm gonna gather up every right-minded dwarf I can find, and we're going to figure out how to get to those islands. And when we come back, we'll have an army great enough to grind the Stone Summit into powder. The iron is hot, and it is time to strike.",
The otter is very full. Come back later!,
"The ouroboros turns eternally, vine and serpent entwined in me.",
The overzealous toy soldiers are out of control!,
The owner must choose a boost first.,
"The owner of this focus was able to seal specific chests with ""shreds"" of their soul. Supposedly, they'd be alerted if someone tried to open them and be able to act accordingly. Likely with some form of curse, I'm told.",
The Ox's Yoke,
The Pact,
The Pact and its allies fought valiantly but failed to secure Verdant Brink. Now nightfall approaches along with new threats.,
The Pact and its allies have dominated the Mordrem in Verdant Brink. They stand firm in the light of a new day.,
The Pact and its allies have fully secured Verdant Brink. Nightfall approaches but the Pact stands defiant.,
The Pact and its allies have mostly secured Verdant Brink. Nightfall approaches and the Pact stands firm.,
The Pact and its allies have secured Verdant Brink. Nightfall approaches but the Pact stands defiant.,
The Pact and its allies made a valiant effort but were no match for the elements or the Mordrem. The dawn of a new day brings a second chance.,
"The Pact and its allies saw some success in the effort to secure Verdant Brink, but nightfall approaches along with new threats.",
"The Pact and its allies survived the elements and the Mordrem, but the dawn of a new day threatens new terrors.",
"The Pact and its allies were mostly successful against the elements and the Mordrem, but the dawn of the new day threatens new terrors.",
The Pact and the re-formed Destiny's Edge are launching a desperate assault on the Elder Dragon Zhaitan.,
The Pact and their allies managed to survive another night. The dawn of a new day is another chance to push on into the jungle.,
"The Pact continues its advancement into Orr, establishing a base beneath the ruined temple of Lyssa. A command post in that location would be a critical foothold in the war against Zhaitan.",
The Pact fought off a punishing nightlong assault by the Mordrem and holds firm in the light of a new day.,
The Pact has failed to stop the Mouth of Mordremoth.,
"The Pact has made progress toward being ready to launch an assault on Mordremoth, but they still have much to do. Sand is getting into the machinery and causing breakdowns.",
"The Pact held firm against a punishing nightlong assault by the Mordrem, and they welcome the light of a new day.",
The Pact is devastated after a punishing nightlong assault by the Mordrem. New chances come with a new dawn.,
The Pact is positioning itself to launch an assault on Mordremoth.,
The Pact is preparing to lure out the Death-Branded Shatterer.,
"The Pact is the lifeblood of Tyria right now. Without their unity, we have no chance against the dragons. You have helped our cause, and for that, we thank you.—Captain Harold",
The Pact rally point acts as a staging area for further advancement into Orr.,
The Pact retains control of Amber Sandfall.,
The Pact retains control of Blue Oasis.,
The Pact retains control of Indigo Cave.,
The Pact retains control of Red Rock Bastion.,
The Pact struggled valiantly against a punishing nightlong assault by the Mordrem. New chances come with a new dawn.,
The Pact thanks you for your assistance.,
"The Pact tried to hold firm against a punishing nightlong assault by the Mordrem, and they welcome the light of a new day.",
The Pact was devastated by Mordremoth's forces.,
The Pact's Tactician Syska is definitely not who she pretends to be. Trahearne must be warned immediately.,
"The Pact's Warmaster Caisson is having trouble keeping her crack artillery squad functioning. As the Pact's second-in-command, the job of putting them back on track falls to you.",
"The Pale Tree gave me four seeds with which to view some of Caithe's memories. I found the first location in the Grove itself and saw Caithe and the firstborn over twenty years ago. They were discussing the recent arrival of the secondborn and wondering how to deal with them.A half-naked secondborn interrupted the discussion to let us know that his friends had been captured by ""imps."" At the end of the memory, Caithe and Faolain—yes, the leader of the Nightmare Court today—were racing off to rescue them. I believe the second memory seed location will be in Metrica Province, where the secondborn were taken.",
"The Pale Tree is everywhere her children are, but here, high among the branches, visitors may commune most directly with her and hear her song.",
"The Pale Tree is the mother of the sylvari race. She and her children appeared when the dragons rose, and since then, have fought to protect Tyria. Certainly, she is a wise and powerful being with a unique perspective. Perhaps she knows some way to defeat Zhaitan.",
The party is already waiting to go elsewhere.,
"The party you tried to join is no longer accepting requests to join. The party is either full, no longer searching for additional members, or has been disbanded.",
"The path you cleared has remained secure, allowing Pact soldiers and Wyld Hunt valiants to travel safely and easily. We have you to thank for this, %str1%. Your benevolence will not be forgotten. Safe travels.—Explorer Pentt",
"The peace summit has been approached timidly by both sides, neither knowing if they could truly trust the other. Your work has allowed the delegation members to see that they can meet each other as equals and as allies. Your efforts here will not be forgotten. — Vanguard Lieutenant Viles",
The people of Beetletun appreciate your help.,
"The people of Ebonhawke have known nothing but war for generations. I was born into it. My family pulled iron from the ground so that crafters could use its strength to hammer, to reinforce, to sharpen to a keen edge. As much as we could gather was tossed back into the war. With peace upon us we must find a new use for it, for ourselves. How unexpected that a visitor would show us the importance of being versatile! Iron can rebuild, a soldier can comfort, a traveler can help a city find its feet. From now on, I will try to be as versatile as iron, ready to be shaped to the need. Thank you for showing us this.—Foreman Boslo",
The people of Njordstead are now safe. Good job!,
The People's Deadlock,
The perfect spot!,
The Performance,
The person following you on a skyscale has become lost due to being separated. Avoid traveling large distances at once to allow them to keep up.,
The pirates have been pillaged and conquered. Good job!,
"The pirates have taken refuge deep in the ruins, hiding away in the shadow of an abandoned palace... They don't fear the Risen. Quite the opposite, really—they seem to be drawn to the corroded magic that plagues this region.I've almost encountered their scouts on several occasions. Maybe I'll wiggle my way into their ranks...get a closer look at what they're up to.",
The plague scarabs coalesce.,
The Plan,
The plant needs fresh water or rolling devil fertilizer.,
"The Plan    Target: The Vaults    Location: Lion's Arch    The Mark: Captain Evon Gnashblade    The Take: Said to be six million in gold, double that for silver. Unknown copper amount. Platinum, perhaps? Only touch Evon's personal fortune; meddling with the market itself would only paint targets on us.    Security: Two Lionguard at main entrance, 24-hour watch. Two Lionguard by the vault door, 24-hour watch. Nine staff in lobby. Unknown number of security inside vault. Expected to be heavy, with further traps.    Time: Night. Need exquisite night vison and a sensitive smeller to keep watch. Also require a loud voice to warn us of trouble once we are inside.    Phase 1: Need a team to distract the guards at the front of the vault—someone cacophonous and cute. Rest of the team will approach the back of the vaults from the inner harbor. There is a small creek with some crabs, but no Lionguard. Ideally, we persuade the crabs to help if I can find some brains who can perform a bit of smooth talking. Also need strong swimmers, since this will be exit route. Ribbington has already placed a boat by the bridge for the getaway.    Phase 2: Tunnel through the rock wall by the creek—they were sloppy during the reconstruction, neglected to fix many of the cracks and holes made during the attack. The smallest of us slip through. In case the distraction does not pull the security out of the vault, will need someone unbothered by a bit of bloodshed to deal with them—preferably no casualties—and the ability to fly would be scrumptious; people rarely consider airborne threats, so traps are likely to be ground based. Could get a small flyer to disable them...an insect, perhaps?    Phase 3: Enter Evon's personal vault and start ferrying the gold out to the hired muscle by the tunnel, as much as we can carry. In and out, quick and quiet. Leave enough gold that the copper-coveting charr won't realize anything is missing until it's far too late.    Phase 4: Pearl Islet is particularly pretty this time of year...",
The player allows Steelbane to live.,
The player choose to sympathize with the plight of the Grawl.,
The player choose to sympathize with the plight of the Hylek.,
The player choose to sympathize with the plight of the Ogres.,
The player choose to sympathize with the plight of the Quaggan.,
The player choose to sympathize with the plight of the Skritt.,
The player is a member of the Durmand Priory.,
The player is a member of the Order of Whispers.,
The player is a member of the Vigil,
"The player is already in another party, squad, or guild.",
The player or channel cannot be found.,
"The player who controls the Orb of Impending Doom will deal more damage, but will also take damage over time and is doomed to die a tragic death.",
The player you are trying to whisper is not online.,
The point moves faster when catching up to your team's best push.,
The Politics of Kryta,
The portal is lost! Reclaim the point to restore waypoint and siege turtle support.,
"The portal is unstable and flickers with visions from across the world. It could take you to several different locations, if you time it right.",
The portal user being added already exists in the group.,
The power has been exhausted for today.,
The power node you're carrying has been successfully charged and can now be placed into a power socket.,
The power of adrenal mushrooms instantly refreshes your skills.,
The power of Mordremoth draws you onto the island.,
"The power of the Bloodstones once restricted the use of magic, but that control has weakened with the passing of time.",
The power of the enchanted armor is fading. Turn back to retain the enchanted armor.,
The power of the shrines has failed. They must be reenergized!,
The presence of Branded Forgotten zealots has quieted across the Brand.,
"The pressure plate shifts, but there is not enough mass to trigger activation.",
The Prickly Pair,
The pride of the Arcane Council must be the height of the asuran technologies; those precious gates of theirs.,
The priesthood of Kormir would welcome your help aiding refugees of the warfare raging across our region.,
The primary Pact rally point has fallen to the Mordrem.,
The primary Pact rally point is back under Pact control.,
The primary Pact rally point is under attack!,
"The principal biomancer insisted that any golems traded to the local freebooters be outfitted with fail-safe codes, should they attempt to betray our good-faith exchange for inland manpower and increased coastal harrying. These codes deactivate all combat features. Please ensure multiple copies of these documents are given to all facilty staff. (Note: A compiled list will also be available when time permits.)Previous designation: Mark II Golemite var. V-C-56788  Requested freebooter redesignation: S41ty D0g  S41ty D0g fail-safe code: 1312Previous designation: Mark II Golemite var. V-C-56789  Requested freebooter redesignation: J1mmy  J1mmy fail-safe code: 1723Document 1 of 4",
The Priory appreciates all you've done for them.,
The Priory appreciates your effort in preserving history.,
The Priory appreciates your protection. Thank you!,
The Priory appreciates your support.,
The Priory can now continue its research. Well done!,
The Priory is grateful for your assistance.,
The Priory researchers at Granite Citadel appreciate all you've done.,
"The Priory thanks you for your assistance with our steam creature studies near the Lake of Lamentation. The cameras you fixed helped us monitor the creatures' movements, and the steam parts you collected are being analyzed by our top scientists. We hope to learn more about the biomechanical beings, and your efforts have brought us closer to the truth.—Scholar Darkpaw",
"The Priory's plan is to prove Professor Gorr's theory involves studying a single dragon minion under controlled circumstances...but where the Elder Dragons are concerned, nothing is ever fully under control.",
The prism needs to be charged before it can provide protection.,
The prison has been decommissioned.,
The prisoner has perished.,
The prisoners have been killed. You have failed.,
The prize before the fight.,
"The process has accelerated rapidly in the [lbracket]REDACTED[rbracket] fractal. Subjects are present but...changed. Substantial mutation has been observed. The method of the [lbracket]REDACTED[rbracket] spread has still not been determined, but it has overtaken all subjects it's come into contact with. More frighteningly, symptoms have appeared in the subjects who were far away and only *heard* about it, suggesting that even knowing about [lbracket]REDACTED[rbracket] may be enough for it to take hold.Conclusion: Due to the unique nature of [lbracket]REDACTED[rbracket], we strongly recommend the fractal be expunged and all records of it be heavily censored. [lbracket]REDACTED[rbracket] should be treated as an extreme-level threat, requiring immediate termination of all exposed if it is ever detected in Tyria. Urgent steps need to be taken to ensure [lbracket]REDACTED[rbracket] never becomes aware of Tyria at all.",
The progenitor is destroyed!,
The Prospect of something happening to what you call home is a scary thought.,
"The protective crystals failed to be defended, and the bodies of allies within have been destroyed.",
The public portal to Convergences has opened.,
"The Pure Sound[pl:""Sounds""] of Nature",
The Pure Sounds of Nature,
The PvP league season has started! Greater Call of the Mists is enabled for the first week of the season.,
The PvP league season has started! Queue for ranked arena in the Heart of the Mists to begin your legendary journey.Learn more here.,
"The PvP quick-launch bar lets you change your build, select custom arenas, and queue for unranked and ranked arenas.",
The pylon maintaining Zakiros's malignant fog is reinforced and can only be damaged with Ramses's astral spellbombs.,
The pylon's power burst caused Sohothin to burn brighter.,
The quaestors might have seen this piece.,
The quaggan eggs are about to hatch just as the dragon minion's attack on the quaggan village of Falooaloo is about to begin. Can you defend the quaggans and fight off the ice dragon's horde?,
"The quaggan plague remains contained, for now.",
The Quaggans Need Our Help,
The quaggans thank you for your help.,
"The quaggans' garden is thriving, thanks to you!",
The Queen in Peril,
The queen is one of the most beloved figures in Kryta. Being her guide through the city was a high honor.,
The queen is safe now.,
The queen of Kryta called for a ceremony that attracted many unexpected guests.,
The Queen of the Bog,
The Queen's Necklace (Infused),
The queen's shadows meet in secret under the Shadow of Grenth.,
The Quester's<br>Terrace,
The quick brown fox jumps over the lazy dog. 0123456789 Durka–durr...,
The Quotations of Behn Millen,
The race has finished.,
The race will begin in: %str1%,
The race will end in: %str1%,
The raid quickplay squad is ready. You will enter the instance when the timer ends.,
"The ranch is starting to look half-good. Unless disaster strikes, I think my job is done here. That means your job is done, too. Here's your payment.—Bram Dawnrazer, Dawnright Estate",
The randomizer can be adjusted to a number of settings. Choose a setting.,
The range of your manipulation skills is increased.,
The ranger's hammer has selectable weapon skills when the Untamed trait line is not active. Right-click on weapon skills 2–5 to select an alternate skill for that slot.,
The Raptor,
"The raptor's Tail Spin, [lbracket]%str1%[rbracket] can be used to engage enemies. When used, you will automatically be dismounted.",
The Rata Novan golem is activated and is available for use!,
The Rata Novus lane cannon is nearly lost!,
The Rata Novus lane cannon is taking heavy damage!,
The rate of oil depletion has begun to accelerate.,
The Ravaging of the Jade Runner,
The Raven Sanctum has been captured by the Voice and Claw of the Fallen. Enter the sanctum and defeat the fallen kodan duo so you can cleanse it of their foul magic.,
The ravenous wanderer has been slain.,
The ravine known as Human's Lament lies deep in the heart of Ascalon. Ghosts plague the land and often overwhelm its inhabitants. Constant scouting missions are needed to keep the roads clear.,
The reader does not predict any imminent portal incursions.,
The real gwyldell has been found. Break its shield.,
The real queen (and don't you forget it).,
The Realm of Dreams Season,
The Realm Portals' destruction has unleashed a Legendary Forged Demolisher near Torment's Watch.,
"The recipe for this is contained in the Heat Containment Units recipes, offered for sale by Grandmaster Craftsman Hobbs in Lion's Arch.",
The recipe for this paint is sold by Grandmaster Craftsman Hobbs.,
The Red Flag has been captured!,
The Red Flag has been stolen!,
The Red Team has summoned a Mist Champion,
"The region's harsh magical instability has limited how many times you can be revived. When you are revived from wisp form, this effect is removed.When this effect is removed, you will no longer be able to be revived from wisp form.",
The region's harsh magical instability prevents you from being revived again while in wisp form.,
The Reign of Palawa Joko,
The relic can only grant three wishes per day.,
The relic has trappedyou. Overpower it quickly.,
The remaining cubs have hinted at their locations.,
"The remaining four continued into South Kessex, toward what King Jadon thought could be a possible safe haven. During their detour to ""bury"" the dead, the mursaat had made up for lost ground and would eventually surround them. The duchess and her comrades stared down their attackers as the Veil of Ilya revealed their presence once more. In a blinding moment of flashing sigils and spellcraft, the four were dazed by the light—only to find the mursaat lying dead around them.",
The remnants of a ritual can be found due south of the hunting camp in Untamed Crags.,
The repair and reactivation of the off-line turret was successful.,
The repurposed cannons are targeting the Awakened Inquest!,
The requested guild name contains inappropriate language.,
The requested match is full.,
The researcher has a spell book of seer enchantments. Ask them where they left it.,
The researchers are gathering sketches and notes about the local wildlife. Each one you can get for them is one less they'll fight over.,
The residents of First Haven appreciate your help.,
The resources have already been gathered.,
The rest of you: protect your world. Protect Tyria!,
The Restless Ghosts of the Ascalonian Catacombs,
The Results Are In!,
The Retaking of Orr,
"The Revered Terebinth is safe, and the Nightmare Court has been hampered, thanks to you.",
The rifle needs to be holding at least one jade tech battery charge.,
The Rift,
The rift has been weakened.,
The Rift Has Closed,
The Rift Is Susceptible to Closure,
"The ring was fixed on his left hand, a reminder of the battle days before. While they held Stonemist, it could be minutes until their enemy appeared at the front gate. There was no time for mourning.",
"The Ringmaster has a big show tonight at the carnival. Right out in the open, he's planning to mesmerize the crowd and make them all do his bidding—to take over the poor quarters of Divinity's Reach and start a rebellion against the Queen!",
