english,translate
"The tantalizing steam shrouded his strong form in a veil of vapor and mystique. But she knew it was him. Of course it was him. She would recognize his broad warrior's shoulders anywhere. If only, she thought, she could dig her own claws deep into the ridges of his back, she'd leave him some battle scars of her own.""I take it you got my letter."" His voice was deep, a tad hoarse, but somehow melodious in its rugged candor.""We shouldn't be here,"" is all she could manage to whisper. He turned and flashed her a mischievous, fanged smile. And my, what impressive fangs he had.""Isn't that half the fun?""She wasn't sure if it was the warmth of the Bergen Springs that caused the heat to rise in her cheeks, or something far hotter.""What if they find you? They'll kill you!""""Then let's make it a night to die for.""",
The target is now vulnerable!,
The target party is already waiting to enter the mission.,
The target party's members do not all meet mission requirements.,
"The tavern is one of the main buildings you can build in your guild hall. Gamli, the tavern's proprietor, offers upgrades related to socialization and boons. The tavern is also the place that new proprietors will arrive, so check back to see what other buildings can be restored. Talk to Gamli in your guild hall to fund the restoration of the tavern and purchase other tavern upgrades.",
"The teams must be balanced. Volunteering will give you a volunteer bonus, and players balanced always receive the winner bonus. Lack of volunteers will require autobalancing by random selection. Would you like to volunteer?",
The technician is under attack!,
The technomagical detector requires 25 Unbound Magic to open the stash.,
"The tectonic thumper desynchronized, the titan got away, and the wayfinder...failed? Wait, that's...that's not what happened. It can't be.",
The tectonic thumper is irreparably damaged and nonfunctional. Stoic Alder's tale has taken an unexpected turn for the worse. You will be returned to Harvest Den soon.,
"The tectonic thumper is irreparably damaged, and Decima has escaped.",
"The tectonic thumper is irreparably damaged, and Greer has escaped.",
"The tectonic thumper is irreparably damaged, and Ura has escaped.",
The tectonic thumper is irreparably damaged.,
The tectonic thumper is losing synchonization and the mission will fail if it fully depletes. Reclaim base camp before it's too late.,
"The tectonic thumper lost synchronization, and the titan won. This is what happens when you celebrate too quickly, cubs.",
The temple has fallen silent.,
The Tendril Torching adventure is now available.,
The tengu are marshaling at the Eye of the North. Earn support marks to purchase rewards and contribute toward bonus rewards!,
"The tengu, Soar Goldbeak, finally confessed that the Dengatl are working with a third tribe of hylek mystics. Whatever potion they're making with the zalisco extract, it's bound to be dangerous.",
The Tentacle Is Vulnerable,
The Terror of the Sands,
The tested codepath was run.,
The Thief of Toys,
The thing I fear most %str1%,
the Third Battle of the Brand.,
The third floor of the Tower of Nightmares has opened.,
"The three Orders of Tyria have agreed to meet and discuss a united effort in Orr. If the leaders can put aside their differences, they could retake Claw Island—and one day they might even defeat Zhaitan.",
The Thrill[s] of Battle,
The time has come to battle Drakkar. Stand by Jhavi's side and join the offensive!,
The time of dragons ends and a new age begins.,
The time period to attempt a reconnect has elapsed.,
The timing of my return was fortuitous.,
The tiny quaggan Shooshadoo has made up their mind to follow in your footsteps as a champion of Tyria. You'll need to carry them until their stride is a bit longer.,
The titan has been drawn to the surface.,
The titan has been drawn to the surface. Work with your Convergence party to defeat it before it escapes.,
The titan has burrowed into the mountain.,
"The titan has burrowed into the mountain. Use warclaws to sniff out the titan's path, gather its stench, and draw it back to the surface.",
The titan's armor protects it. Restrain the titan using your warclaw to expose its weakness.,
The titan's immune system has ejected you.,
The titan's immune system has ejected you. You have been sent to a friendly outpost.,
"The titan's spawn—referred to as ""shards"" by a few of the locals—act in a subservient fashion in favor of their progenitor. One of my research assistants has hypothesized that they are no different than white blood cells inside the body, mindlessly reacting to the progenitor titan's needs. They attack threats to the body. They attempt to seal the body's wounds. When one is killed, the primary specimen releases another.",
The titanic macrophage revived! It is shielding the nodules.,
The titans are planning something big in Janthir Syntri. Of Mists and Monsters will begin in 10 minutes.,
The titans have been successfully driven away from the bloodstones and back to their lairs. The Mists Tide has waned.,
The titans have consumed all the power they needed from the bloodstones. Only time will tell what will happen to the island now.,
The titans have consumed the energy of the bloodstone fragment. It's destabilizing!,
The titanspawn sapper has been found.,
The titanspawn sapper has been found. Slay the sapper before it escapes with stolen calibrated essence.,
The Tome of Leyscribe Poema,
The Tooth,
The top %num1% achievements in your watch list will display in the HUD.,
The top-ranked guild teams that competed in the current PvP season.Conquest Only,
The Tormented,
The Toughest Challenge Yet,
"The tower climbs high and holds infinite secrets. If one climbs high enough, maybe those secrets will reveal themselves...",
